Postcode,Latitude,Longitude,Easting,Northing,Grid Reference,Town/Area,Region,Postcodes,Active postcodes,Population,Households,Nearby districts
DN17,53.5733,-0.7032,485969,409303,SE859093,"Althorpe, Amcotts, Bottesford Moor, Bottesford, Crowle, Derrythorpe, Ealand, East Butterwick, Eastoft, Garthorpe, Gunness, Keadby, Luddington, Messingham, North Ewster, Scunthorpe, Susworth, West Butterwick, Yaddlethorpe",North Lincolnshire,1118,953,37207,15662,"DN16, DN15, DN21, DN20, HU15, DN9, DN8, YO43, DN38, DN7"
DN18,53.6819,-0.446229,502721,421725,TA027217,"Barton-Upon-Humber",North Lincolnshire,437,360,11932,5210,"HU13, HU10, DN19, HU14, HU4, HU16, HU3, HU5, HU20, HU1"
DN19,53.6846,-0.36581,508025,422145,TA080221,"Barrow-Upon-Humber",North Lincolnshire,273,241,6296,2639,"HU3, DN18, HU5, HU4, HU1, HU2, HU6, DN39, HU13, HU10"
DN20,53.5578,-0.503572,499224,407839,SE992078,"Brigg, Broughton, Hibaldstow, Scawby, Wrawby",North Lincolnshire,831,661,19373,8262,"DN38, DN16, DN18, HU14, DN15, DN17, HU20, LN7, HU13, DN39"
DN21,53.4173,-0.710059,485829,391941,SK858919,"Gainsborough",West Lindsey,1645,1312,37066,15960,"DN17, DN16, DN10, DN15, DN9, LN1, DN22, LN6, DN20, LN2"
DN22,53.3246,-0.929673,471388,381387,SK713813,"Ranskill, Retford",Bassetlaw,1482,1206,35943,15079,"DN10, NG22, DN9, S81, S80, NG25, DN11, DN21, DN8, S25"
DN31,53.5709,-0.0845028,526942,409961,TA269099,"Grimsby",North East Lincolnshire,971,476,9600,4551,"DN32, DN34, DN33, DN35, DN37, DN36, DN41, DN40, HU12, HU19"
DN32,53.5632,-0.0711277,527851,409128,TA278091,"Grimsby",North East Lincolnshire,914,652,29968,13332,"DN31, DN35, DN34, DN33, DN36, DN37, DN41, DN40, HU12, HU19"
DN33,53.5406,-0.0985022,526105,406565,TA261065,"Grimsby",North East Lincolnshire,603,527,19536,8136,"DN34, DN31, DN32, DN37, DN35, DN36, DN41, DN40, HU12, LN11"
DN34,53.558,-0.111968,525161,408477,TA251084,"Grimsby",North East Lincolnshire,557,466,19271,8391,"DN33, DN31, DN37, DN32, DN35, DN41, DN36, DN40, HU12, DN39"
DN35,53.5555,-0.0379518,530071,408332,TA300083,"Cleethorpes",North East Lincolnshire,979,816,34580,15433,"DN32, DN36, DN31, DN33, DN34, DN37, DN41, HU19, LN11, DN40"
DN36,53.5135,-0.0400369,530062,403656,TA300036,"Holton le Clay, Humberston, Ludborough, Marshchapel, New Waltham, North Cotes, North Thoresby, Tetney",North East Lincolnshire,707,621,19200,8251,"DN35, DN32, DN33, DN31, DN34, DN37, LN11, DN41, HU19, DN40"
DN37,53.5509,-0.149341,522707,407622,TA227076,"Ashby-cum-Fenby, Barnoldby-le-Beck, Beelsby, Bradley, Brocklesby, Great Coates, Great Limber, Irby-upon-Humber, Laceby, Waltham",North East Lincolnshire,994,649,21707,9205,"DN34, DN33, DN41, DN31, DN32, DN35, DN40, DN36, HU12, DN39"
DN38,53.5603,-0.397239,506261,408270,TA062082,"Barnetby, Grasby, Searby, Somerby",North Lincolnshire,122,103,2886,1192,"DN20, DN39, LN7, DN19, DN18, HU4, HU13, HU3, HU5, DN41"
DN39,53.6171,-0.329609,510592,414691,TA105146,"Croxton, Kirmington, Ulceby, Wootton",North Lincolnshire,136,108,2785,1210,"DN19, DN40, DN38, HU1, LN7, HU2, HU3, DN41, HU9, HU7"
DN40,53.6216,-0.22399,517565,415361,TA175153,"North Killingholme, South Killingholme, Habrough, Immingham, East Halton",North Lincolnshire,612,460,12234,5285,"DN41, DN39, DN37, DN34, DN31, HU12, HU9, DN19, DN33, DN32"
DN41,53.5848,-0.195638,519544,411315,TA195113,"Healing, Keelby, Stallingborough",North East Lincolnshire,267,233,6279,2620,"DN40, DN37, DN34, DN31, DN33, DN32, DN39, DN35, HU12, DN38"
DT1,50.7125,-2.44417,368736,90413,SY687904,"Dorchester",West Dorset,1100,788,19063,8451,"DT2, DT3, DT4, DT5, DT9, BA8, BH20, DT10, DT6, BA9"
DT2,50.7485,-2.44937,368393,94418,SY683944,"Dorchester",West Dorset,1270,1114,24674,10688,"DT1, DT3, DT4, DT5, DT9, BA8, DT10, DT6, BA9, BH20"
DT3,50.6405,-2.46694,367078,82416,SY670824,"Weymouth",Weymouth and Portland,779,677,23389,10201,"DT4, DT1, DT5, DT2, DT9, BH20, DT6, BA8, DT10, DT8"
DT4,50.6099,-2.4632,367321,79012,SY673790,"Weymouth",Weymouth and Portland,1473,992,37011,16645,"DT3, DT5, DT1, DT2, DT9, BH20, DT6, BA8, DT10, BH19"
DT5,50.5494,-2.4428,368724,72275,SY687722,"Portland",Weymouth and Portland,403,315,12844,5175,"DT4, DT3, DT1, DT2, BH20, DT9, BA8, DT10, DT6, BH19"
DT6,50.7387,-2.77474,345427,93518,SY454935,"Bridport",West Dorset,1208,1002,21669,10168,"DT8, TA18, DT7, TA16, TA17, TA14, TA12, TA13, TA15, EX13"
DT7,50.7293,-2.94579,333344,92613,SY333926,"Lyme Regis",West Dorset,337,283,5462,2542,"EX13, EX24, EX12, TA20, DT6, TA19, DT8, TA17, TA18, TA16"
DT8,50.815,-2.75804,346693,101990,ST466019,"Beaminster",West Dorset,269,230,5893,2738,"DT6, TA18, TA16, TA14, TA17, TA15, TA12, TA13, BA20, BA21"
DT9,50.9426,-2.51674,363791,116033,ST637160,"Sherborne",West Dorset,1100,892,20768,9121,"BA21, BA20, BA22, BA7, BA8, DT10, TA15, BA9, BA10, TA14"
DT10,50.9372,-2.33146,376806,115358,ST768153,"Sturminster Newton",North Dorset,546,447,11901,5209,"BA8, SP8, DT9, BA9, SP7, DT11, BA10, BA11, DT2, BA20"
DT11,50.8615,-2.1799,387435,106903,ST874069,"Blandford Forum",North Dorset,1337,1054,30122,12115,"SP7, BH20, DT10, BH21, BH16, SP8, BH18, BA12, BH17, BH31"
DY1,52.5151,-2.09433,393696,290805,SO936908,"Dudley town centre, Woodsetton",Dudley,1186,800,31930,12746,"DY2, DY3, DY4, WV14, DY5, B64, B69, B65, DY6, WV2"
DY2,52.4976,-2.0826,394489,288858,SO944888,"Dudley, Kates Hill, Netherton",Dudley,977,746,34384,13541,"DY1, B64, B65, DY5, B63, B69, DY4, WV14, DY3, B62"
DY3,52.5298,-2.12865,391370,292444,SO913924,"Sedgley, Lower Gornal, Upper Gornal, Gornalwood, Himley, Swindon, Woodsetton",Dudley,928,809,34092,14563,"WV4, DY1, WV2, DY5, DY6, WV1, WV3, DY4, DY2, WV14"
DY4,52.5319,-2.05445,396403,292671,SO964926,"Tipton, Tividale, Coseley",Dudley,1246,960,43166,17293,"WV14, DY1, B69, WS10, B65, WV13, DY2, B70, B71, B64"
DY5,52.481,-2.12281,391756,287015,SO917870,"Brierley Hill, Pensnett, Quarry Bank",Dudley,1231,940,42246,17324,"DY9, DY8, DY3, DY2, DY6, B64, DY1, B65, B63, WV2"
DY6,52.4989,-2.16436,388939,289012,SO889890,"Kingswinford",Dudley,1013,741,28148,11726,"DY8, DY5, DY3, WV5, DY2, DY1, DY7, WV4, WV3, DY9"
DY7,52.4646,-2.21792,385292,285206,SO852852,"Kinver, Enville, Stourton",South Staffordshire,440,337,8028,3389,"WV98, DY8, WV5, DY6, DY10, DY5, DY9, DY11, DY3, B64"
DY8,52.4599,-2.15389,389641,284672,SO896846,"Stourbridge, Wollaston, Wordsley, Amblecote",Dudley,1668,1198,50208,21529,"DY6, DY5, DY9, DY7, B63, DY3, B64, DY2, DY1, B62"
DY9,52.4375,-2.12419,391654,282177,SO916821,"Lye, Pedmore, Hagley",Dudley,1100,844,30036,12206,"DY5, DY8, B63, B64, DY3, DY6, DY2, DY1, B62, DY7"
DY10,52.3862,-2.2292,384498,276488,SO844764,"Kidderminster",Wyre Forest,1302,956,35670,15576,"WV98, DY11, DY7, DY12, DY13, DY8, DY9, WV5, DY6, WR3"
DY11,52.3854,-2.26034,382378,276406,SO823764,"Kidderminster",Wyre Forest,1085,811,30311,13054,"DY10, WV98, DY12, DY13, DY7, DY8, DY9, WV5, DY14, DY6"
DY12,52.3865,-2.32369,378067,276546,SO780765,"Bewdley",Wyre Forest,698,564,12059,5507,"DY11, DY13, DY10, WV98, DY14, DY7, WV15, WR6, WV16, DY8"
DY13,52.3372,-2.28087,380960,271050,SO809710,"Stourport-on-Severn",Wyre Forest,895,662,22334,9867,"DY11, DY12, DY10, WV98, WR2, WR6, DY7, WR3, WR9, WR99"
DY14,52.381,-2.4561,369051,275983,SO690759,"Cleobury Mortimer",Shropshire,685,600,8235,3371,"DY12, WV16, WR15, DY11, WV15, DY13, DY10, WR6, SY8, TF12"
E1,51.5163,-0.0604232,534678,181492,TQ346814,"Aldgate, Bishopsgate, Whitechapel, Shoreditch, Spitalfields, Shadwell, Stepney, Mile End, Portsoken",Tower Hamlets,2977,1479,69523,25177,"E1W, E77, E98, E2, EC3A, EC3N, EC3B, SE16, EC88, EC2N"
E1W,51.5118,-0.0593114,534769,180993,TQ347809,"Wapping",Tower Hamlets,855,412,12691,6206,"E1, E98, E77, SE16, E2, EC3N, EC3B, EC3M, EC3A, EC3R"
E2,51.5301,-0.0622784,534509,183023,TQ345830,"Bethnal Green, Haggerston, Shoreditch, Cambridge Heath",Tower Hamlets,1563,962,46341,19255,"E8, E1, E1W, EC88, E77, E98, E9, EC2A, EC3A, EC3N"
E3,51.5282,-0.0258128,537044,182879,TQ370828,"Bow, Bromley-by-Bow, Old Ford, Mile End, Three Mills, London Gas Museum",Tower Hamlets,1553,1114,52097,20329,"E14, E20, E9, E15, E2, E1, SE8, E1W, E13, E8"
E4,51.6239,-0.00321129,538321,193564,TQ383935,"Chingford, Sewardstone, Highams Park",Waltham Forest,1523,963,60262,23895,"IG9, IG8, E17, N9, E18, E10, E11, N18, EN3, EN9"
E5,51.5592,-0.054675,534950,186273,TQ349862,"Upper Clapton, Lower Clapton, Leyton, Stoke Newington",Hackney,1152,649,47669,18830,"E9, N16, E8, E2, E1, N5, E10, E1W, N15, N17"
E6,51.5252,0.0551741,542671,182700,TQ426827,"East Ham, Beckton, Upton Park, Barking",Newham,1925,903,78955,24340,"E12, E13, IG11, E16, E7, IG1, IG4, SE18, SE7, E15"
E7,51.5476,0.0261474,540588,185135,TQ405851,"Forest Gate, Stratford",Newham,1033,520,54565,16334,"E13, E12, E11, E15, E20, E16, E18, E6, IG1, IG4"
E8,51.5412,-0.0649666,534290,184252,TQ342842,"Hackney Central, Dalston, London Fields",Hackney,1315,737,39275,17254,"E2, E9, E5, E1, EC88, E77, E98, N16, E1W, N1"
E9,51.5418,-0.0466257,535560,184353,TQ355843,"Homerton, Hackney Wick, South Hackney, Hackney Marshes, Victoria Park",Hackney,1034,650,38442,15991,"E8, E5, E2, E3, E1, E20, E1W, EC88, E15, E77"
E10,51.5687,-0.0129171,537816,187407,TQ378874,"Leyton, Temple Mills, Hackney Marshes, Upper Clapton, Walthamstow Marshes",Hackney,1107,592,42998,15255,"E20, E17, E11, E15, E5, E3, E7, E9, E18, E4"
E11,51.5674,0.0116519,539522,187309,TQ395873,"Leytonstone, Wanstead, Aldersbrook, Snaresbrook, Cann Hall",Waltham Forest,1495,845,55128,21725,"E10, E7, E18, E15, E20, E17, IG4, E13, E12, E16"
E12,51.551,0.0507953,542286,185560,TQ422855,"Manor Park, Little Ilford, Aldersbrook",Newham,716,396,41869,12572,"E7, IG1, E6, IG4, E13, IG5, IG2, E11, IG11, IG3"
E13,51.5282,0.0258566,540628,182977,TQ406829,"Plaistow, West Ham, Upton Park",Newham,928,558,46913,15569,"E7, E16, E6, E15, E12, SE7, E3, E11, E20, E18"
E14,51.5076,-0.0207582,537456,180598,TQ374805,"Poplar, Isle of Dogs, Limehouse, Canary Wharf, Blackwall, Cubitt Town",Tower Hamlets,2819,1792,82542,34296,"E3, SE8, E1W, E98, SE10, SE16, E16, E1, E20, E15"
E15,51.5386,0.000449369,538834,184085,TQ388840,"Stratford, West Ham, Maryland, Leyton, Leytonstone, Temple Mills, Hackney Wick, Bow",Newham,1440,798,52244,19569,"E20, E7, E13, E3, E11, E10, E16, E9, E14, SE10"
E16,51.5114,0.020812,540329,181099,TQ403810,"Silvertown, North Woolwich, Canning Town, Custom House, London City Airport",Newham,1379,926,45105,17275,"E13, SE7, E7, E14, SE3, SE10, E15, E6, E3, E11"
E17,51.5864,-0.0202249,537256,189361,TQ372893,"Walthamstow, Upper Walthamstow",Waltham Forest,2664,1481,103402,38605,"E10, E20, E11, E18, E4, E5, N17, E3, E15, N15"
E18,51.5926,0.0255458,540408,190138,TQ404901,"Woodford, South Woodford",Redbridge,657,371,19022,8136,"IG8, E11, IG4, IG9, E7, IG5, E17, E4, IG6, E10"
E20,51.5465,-0.0105023,538050,184943,TQ380849,"Olympic Park, Stratford",Newham,187,171,,,"E15, E10, E3, E7, E9, E11, E14, E17, E13, E5"
EH1,55.9522,-3.19192,325669,673882,NT256738,"Old Town",Edinburgh,759,325,6471,3030,"EH99, EH2, EH3, EH9, EH8, EH7, EH6, EH10, EH5, EH16"
EH2,55.9532,-3.20043,325140,674003,NT251740,"New Town",Edinburgh,795,212,870,426,"EH3, EH99, EH1, EH9, EH8, EH5, EH10, EH7, EH6, EH4"
EH3,55.9524,-3.20452,324883,673918,NT248739,"New Town, West End, Tollcross, Fountainbridge",Edinburgh,1485,735,24459,12377,"EH2, EH99, EH1, EH9, EH5, EH10, EH8, EH7, EH6, EH4"
EH4,55.9624,-3.25536,321728,675087,NT217750,"Dean Village, Comely Bank, Barnton, Cramond",Edinburgh,2153,1620,53734,24459,"EH95, EH11, EH12, EH5, EH3, EH2, EH13, EH91, EH99, EH1"
EH5,55.9746,-3.21938,323998,676405,NT239764,"Granton",Edinburgh,768,618,19621,9348,"EH3, EH95, EH2, EH99, EH4, EH6, EH1, EH10, EH7, EH11"
EH6,55.9712,-3.17389,326831,675977,NT268759,"Leith, Newhaven",Edinburgh,1436,977,39099,20892,"EH7, EH8, EH1, EH99, EH2, EH5, EH3, EH9, EH16, EH15"
EH7,55.9599,-3.16473,327381,674710,NT273747,"Leith, Restalrig, Craigentinny",Edinburgh,1121,768,34265,18684,"EH8, EH6, EH1, EH99, EH2, EH3, EH9, EH16, EH15, EH5"
EH8,55.9499,-3.16628,327266,673599,NT272735,"Southside, Newington, Canongate, Northfield, Mountcastle",Edinburgh,767,558,24077,11489,"EH7, EH1, EH6, EH99, EH2, EH9, EH3, EH16, EH15, EH17"
EH9,55.9332,-3.18694,325944,671762,NT259717,"Marchmont, Grange, Blackford",Edinburgh,737,517,23280,9584,"EH1, EH99, EH2, EH10, EH3, EH8, EH16, EH7, EH6, EH11"
EH10,55.9216,-3.2108,324431,670497,NT244704,"Bruntsfield, Morningside, Fairmilehead",Edinburgh,1145,867,33092,14277,"EH9, EH3, EH2, EH13, EH99, EH1, EH11, EH5, EH16, EH8"
EH11,55.9334,-3.25141,321917,671855,NT219718,"Haymarket Station, Gorgie, Stenhouse, Sighthill",Edinburgh,1287,945,39578,20582,"EH12, EH4, EH13, EH91, EH95, EH14, EH10, EH9, EH3, EH2"
EH12,55.9414,-3.27404,320519,672771,NT205727,"Haymarket, Murrayfield, Corstorphine",Edinburgh,1704,1176,38512,17388,"EH11, EH91, EH14, EH4, EH95, EH13, EH3, EH10, EH2, EH5"
EH13,55.9086,-3.24257,322419,669086,NT224690,"Colinton, Oxgangs",Edinburgh,447,378,14638,6370,"EH11, EH14, EH10, EH12, EH4, EH91, EH9, EH95, EH3, EH2"
EH14,55.9115,-3.28108,320018,669452,NT200694,"Slateford, Longstone, Wester Hailes, Juniper Green, Currie, Balerno",Edinburgh,1263,1011,39720,17267,"EH91, EH12, EH13, EH11, EH4, EH10, EH95, EH9, EH3, EH2"
EH15,55.9472,-3.11309,330582,673244,NT305732,"Portobello, Duddingston",Edinburgh,811,622,20661,9208,"EH8, EH16, EH7, EH17, EH21, EH18, EH19, EH1, EH6, EH99"
EH16,55.9238,-3.15131,328152,670679,NT281706,"Liberton, Cameron Toll, Craigmillar, Niddrie",Edinburgh,1148,853,29591,12639,"EH17, EH8, EH9, EH20, EH7, EH15, EH10, EH1, EH6, EH99"
EH17,55.9069,-3.14424,328563,668790,NT285687,"Gilmerton, Moredun, Mortonhall",Edinburgh,612,520,18560,8114,"EH16, EH20, EH18, EH8, EH24, EH9, EH15, EH7, EH19, EH10"
EH28,55.9284,-3.40418,312362,671482,NT123714,"Newbridge, Ratho",Edinburgh,177,134,2830,1233,"EH29, EH27, EH30, EH52, EH53, EH91, KY11, EH14, EH12, EH54"
EH29,55.9569,-3.39545,312971,674643,NT129746,"Kirkliston",Edinburgh,131,120,3647,1498,"EH28, EH30, EH27, KY11, EH52, EH91, EH12, KY99, EH53, EH4"
EH30,55.9827,-3.37827,314101,677493,NT141774,"South Queensferry",Edinburgh,278,229,9506,3988,"EH29, EH28, KY11, EH95, KY99, EH27, EH91, EH4, EH12, KY4"
EN1,51.6532,-0.0706861,533564,196696,TQ335966,"Bush Hill Park, Bulls Cross, Enfield Town, Forty Hill",Enfield,1694,981,45679,17865,"EN2, EN3, N9, N18, N21, N17, EN7, N13, N14, EN8"
EN2,51.6585,-0.0917015,532095,197248,TQ320972,"Botany Bay, Clay Hill, Crews Hill, Bulls Cross, Enfield Chase, Enfield Town, Forty Hill",Enfield,1186,828,29515,12618,"EN1, N21, N13, EN3, N14, N9, N18, EN7, N22, EN4"
EN3,51.6581,-0.0416301,535560,197295,TQ355972,"Enfield Highway, Enfield Island Village, Enfield Lock, Enfield Wash, Ponders End",Enfield,1437,993,57042,21073,"EN1, EN8, N9, EN2, N18, E4, EN7, N21, EN9, N17"
EN4,51.6482,-0.162348,527238,195977,TQ272959,"Hadley Wood, Cockfosters, East Barnet, New Barnet",Enfield,886,549,25767,10077,"EN5, N20, N14, N12, N11, N2, EN6, N10, N21, N3"
EN5,51.6483,-0.190501,525290,195939,TQ252959,"High Barnet, Arkley",Barnet,1759,1068,37724,15403,"EN4, N20, N12, N3, EN6, N14, NW11, NW7, N2, N11"
EN6,51.699,-0.179809,525889,201596,TL258015,"Potters Bar, South Mimms, Cuffley, Northaw",Hertsmere,1412,886,29082,11892,"EN5, EN4, AL9, N20, N12, AL7, N3, AL10, N14, N2"
EN7,51.7082,-0.0645736,533825,202824,TL338028,"Cheshunt",Broxbourne,609,483,21884,8256,"EN8, EN1, EN3, EN10, EN2, N9, EN9, SG13, N18, N21"
EN8,51.6962,-0.0331983,536029,201548,TL360015,"Waltham Cross, Cheshunt",Enfield,1470,927,35807,14936,"EN7, EN9, EN3, EN10, EN1, EN11, N9, EN2, E4, N18"
EN9,51.6946,0.0104443,539050,201452,TL390014,"Waltham Abbey",Epping Forest,865,674,23599,10163,"EN8, EN10, E4, EN3, EN7, EN11, IG9, IG10, IG8, CM16"
EN10,51.7409,-0.0211214,536728,206541,TL367065,"Broxbourne",Broxbourne,571,419,17203,6855,"EN11, EN8, SG12, EN7, EN9, SG13, EN3, CM92, CM19, SG14"
EN11,51.7638,-0.00934386,537472,209110,TL374091,"Hoddesdon",Broxbourne,1104,655,21478,8769,"EN10, SG12, CM92, CM19, SG13, EN9, EN8, EN7, CM20, CM18"
EX1,50.7268,-3.51019,293505,92996,SX935929,"Exeter city centre",Exeter,1439,815,21285,9191,"EX4, EX2, EX3, EX5, EX6, EX7, TQ14, EX8, EX16, EX11"
EX2,50.7114,-3.51527,293112,91291,SX931912,"St Thomas, Countess Wear , Wonford",Exeter,1826,1368,40668,17829,"EX1, EX4, EX3, EX6, EX5, EX7, TQ14, EX8, EX16, TQ1"
EX3,50.6939,-3.45985,296986,89267,SX969892,"Exeter",Exeter,294,208,4722,2306,"EX2, EX1, EX5, EX4, EX7, EX8, EX6, TQ14, EX9, EX10"
EX4,50.7302,-3.5265,292362,93398,SX923933,"Exwick, St Thomas, Beacon Heath , Redhils",Exeter,2090,1454,55148,21603,"EX1, EX2, EX3, EX5, EX6, EX7, TQ14, EX8, EX16, EX11"
EX5,50.7549,-3.43688,298740,96018,SX987960,"Clyst St. Mary, Woodbury",East Devon,1270,1092,18799,7884,"EX3, EX1, EX4, EX2, EX11, EX8, EX7, EX15, EX16, EX9"
EX6,50.6758,-3.59259,287568,87447,SX875874,"Haldon, Mamhead, Exminster",Teignbridge,856,727,13740,5919,"EX2, EX4, EX1, EX3, TQ12, TQ13, EX7, TQ14, EX5, EX8"
EX7,50.5861,-3.47124,295943,77296,SX959772,"Dawlish",Exeter,609,478,12502,5663,"TQ14, EX8, EX3, TQ1, EX2, EX1, TQ2, TQ12, EX4, EX9"
EX8,50.6284,-3.40306,300859,81906,SY008819,"Exmouth",Exeter,1406,1081,37440,16304,"EX9, EX7, EX3, EX5, TQ14, EX2, EX1, EX10, EX4, EX11"
EX9,50.6389,-3.32366,306495,82970,SY064829,"Budleigh Salterton",Exeter,401,315,6834,3225,"EX8, EX10, EX11, EX3, EX7, EX5, EX15, EX2, TQ14, EX1"
EX10,50.6919,-3.24575,312104,88768,SY121887,"Sidmouth",Exeter,979,838,16778,7954,"EX11, EX9, EX14, EX12, EX24, EX3, EX8, EX5, EX15, EX2"
EX11,50.7472,-3.28863,309182,94969,SY091949,"Ottery Saint Mary",Exeter,393,335,7999,3403,"EX10, EX9, EX14, EX5, EX15, EX24, EX3, EX8, EX1, EX12"
EX12,50.7067,-3.0811,323757,90231,SY237902,"Seaton",Exeter,591,493,9306,4554,"EX24, EX13, DT7, EX10, EX14, EX11, TA20, EX9, TA3, TA1"
EX13,50.7738,-3.02537,327796,97636,SY277976,"Axminster",Exeter,955,601,11722,5289,"EX24, EX12, DT7, TA20, EX14, TA3, TA19, DT6, EX11, EX10"
EX14,50.8109,-3.20016,315539,101947,ST155019,"Honiton",Exeter,1778,958,20810,9239,"EX11, EX10, EX24, TA21, EX15, EX13, EX12, EX5, EX9, TA1"
EX15,50.8756,-3.34607,305390,109319,ST053093,"Cullompton, Plymtree",Exeter,1004,865,21043,8706,"EX11, EX16, TA21, EX14, EX5, EX9, TA4, EX10, TA23, EX3"
EX16,50.9206,-3.49089,295302,114518,SS953145,"Tiverton",Mid Devon,1591,1327,32234,13726,"TA22, EX15, EX1, EX5, EX4, EX2, EX3, TA24, TA21, EX17"
EX17,50.8101,-3.70166,280205,102552,SS802025,"Crediton",Mid Devon,1146,993,19490,8191,"TQ13, EX6, EX4, EX1, EX18, EX2, EX36, EX5, EX16, EX3"
EX18,50.9016,-3.88659,267436,113042,SS674130,"Chulmleigh",Exeter,221,197,2958,1314,"EX19, EX37, EX36, EX17, EX20, EX38, EX32, EX31, EX35, EX16"
EX19,50.876,-3.9998,259399,110405,SS593104,"Winkleigh",Exeter,251,211,3611,1625,"EX18, EX20, EX37, EX38, EX32, EX31, EX21, EX36, EX17, EX39"
EX20,50.7507,-4.01541,257921,96503,SX579965,"Okehampton",Exeter,1161,995,20125,8511,"EX19, EX21, EX18, EX37, EX38, PL20, PL19, EX32, PL16, EX17"
EX21,50.8035,-4.20909,244435,102764,SS444027,"Beaworthy",Exeter,309,279,4405,1769,"EX22, EX38, PL16, EX39, EX20, EX19, PL18, PL19, EX23, EX33"
EX22,50.8265,-4.36674,233409,105665,SS334056,"Holsworthy",Exeter,671,605,10653,4368,"EX23, EX21, PL15, PL16, EX39, EX38, PL17, EX19, EX20, PL18"
EX23,50.8249,-4.53419,221611,105879,SS216058,"Bude, Coombe, Crackington Haven, Launcells, Poundstock, Stratton",Cornwall,815,670,15620,6872,"EX22, PL35, PL32, PL15, EX21, PL34, PL33, PL14, PL16, EX39"
EX24,50.7375,-3.08733,323368,93662,SY233936,"Colyton",Exeter,239,210,3728,1683,"EX12, EX13, DT7, EX14, EX10, EX11, TA20, TA1, TA3, TA2"
EX31,51.0854,-4.0677,255276,133820,SS552338,"Barnstaple",Exeter,1187,957,25086,10388,"EX32, EX33, EX34, EX37, EX38, EX39, EX19, EX36, EX18, EX35"
EX32,51.0732,-4.02711,258081,132385,SS580323,"Barnstaple",Exeter,1111,828,23896,10147,"EX31, EX37, EX33, EX34, EX19, EX38, EX39, EX36, EX18, EX20"
EX33,51.1126,-4.16622,248465,137043,SS484370,"Braunton",Exeter,420,368,10259,4482,"EX31, EX34, EX39, EX32, EX38, EX37, EX21, EX19, EX35, EX36"
EX34,51.1992,-4.10784,252827,146554,SS528465,"Ilfracombe, Woolacombe",Exeter,839,660,17320,7534,"EX33, EX31, EX32, EX38, EX35, EX39, EX37, EX19, SA3, EX36"
EX35,51.2247,-3.82933,272355,148869,SS723488,"Lynmouth, Lynton",Exeter,152,122,1677,727,"EX36, EX34, EX32, TA24, EX37, EX31, EX18, CF36, SA12, CF33"
EX36,51.017,-3.79978,273853,125721,SS738257,"South Molton",Exeter,461,395,8540,3726,"EX37, EX18, EX35, TA22, EX32, EX17, EX31, EX19, EX16, EX38"
EX37,50.9793,-3.95513,262846,121807,SS628218,"Umberleigh",Exeter,218,199,3562,1466,"EX18, EX19, EX32, EX36, EX31, EX38, EX20, EX39, EX33, EX35"
EX38,50.9452,-4.15084,248998,118399,SS489183,"Torrington",Exeter,376,301,8264,3524,"EX39, EX33, EX21, EX19, EX31, EX37, EX32, EX34, EX18, EX20"
EX39,51.016,-4.24277,242780,126463,SS427264,"Bideford, Lundy Island",Torridge,1596,1331,37177,16773,"EX38, EX33, EX31, EX21, EX32, EX22, EX34, EX37, EX19, PL16"
FK1,55.9888,-3.79299,288245,678765,NS882787,"Falkirk",Falkirk,1251,907,29190,13355,"FK2, FK5, FK3, FK4, FK10, FK6, ML7, FK12, EH49, EH51"
FK2,56.0053,-3.75831,290455,680546,NS904805,"Bainsford, Polmont, Maddiston, Airth",Falkirk,1389,1207,46975,20191,"FK3, FK1, FK5, FK10, FK4, EH51, FK13, FK6, EH49, FK12"
FK3,56.0119,-3.72038,292838,681221,NS928812,"Grangemouth, Glensburgh",Falkirk,620,463,17378,8477,"FK2, FK1, FK5, EH51, EH49, FK13, FK10, EH48, FK4, FK6"
FK4,55.9976,-3.90735,281139,679936,NS811799,"Banknock, Bonnybridge, Haggs",Falkirk,387,336,13480,5507,"FK6, FK7, FK5, FK1, G70, G67, G68, FK2, FK9, ML6"
FK5,56.0255,-3.82021,286655,682894,NS866828,"Larbert, Stenhousemuir, Torwood",Falkirk,528,451,19208,7998,"FK1, FK2, FK6, FK3, FK4, FK10, FK12, FK11, FK7, FK13"
FK6,56.0215,-3.9145,280766,682607,NS807826,"Denny, Fankerton, Stoneywood",Falkirk,419,342,13331,5817,"FK4, FK7, FK5, G70, G67, FK9, FK1, G68, FK2, FK11"
FK7,56.0994,-3.91814,280780,691282,NS807912,"Bannockburn, Plean, Cowie",Falkirk,1050,828,31299,13476,"FK9, FK6, FK4, FK11, FK15, FK8, FK10, FK12, FK5, G70"
FK8,56.129,-4.03424,273657,694783,NS736947,"Stirling, Gargunnock",Falkirk,855,639,18344,8251,"FK16, FK9, FK7, FK15, G68, FK11, G65, G70, FK6, G67"
FK9,56.1416,-3.94137,279468,696019,NS794960,"Bridge of Allan, Lecropt",Falkirk,535,415,13802,4797,"FK7, FK15, FK11, FK8, FK6, FK12, FK16, FK4, FK10, FK13"
FK10,56.115,-3.78333,289210,692793,NS892927,"Alloa, Clackmannan, Sauchie, Tullibody",Falkirk,1086,882,37166,16239,"FK12, FK13, FK11, FK5, FK2, FK1, FK7, PH4, FK14, FK3"
FK11,56.1499,-3.85114,285098,696788,NS850967,"Menstrie",Falkirk,82,75,2863,1231,"FK12, FK9, FK10, FK13, FK7, FK15, FK5, PH4, FK6, FK14"
FK12,56.1521,-3.80153,288186,696951,NS881969,"Alva",Falkirk,167,153,4831,2263,"FK11, FK10, FK13, PH4, FK5, FK14, FK9, FK7, FK1, FK2"
FK13,56.1502,-3.74252,291846,696646,NS918966,"Tillicoultry, Coalsnaughton, Devonside",Falkirk,207,185,6013,2858,"FK12, FK10, FK14, FK11, PH4, FK3, FK2, PH3, FK5, FK9"
FK14,56.1629,-3.66675,296587,697943,NS965979,"Dollar, Glendeven, Burnfoot",Falkirk,193,167,4173,1748,"FK13, FK12, FK10, PH3, FK11, FK3, EH51, PH4, FK2, EH49"
FK15,56.2,-3.95226,278975,702536,NN789025,"Braco",Falkirk,469,362,10600,4222,"FK9, FK16, FK7, FK11, FK8, FK12, PH6, FK6, PH4, FK4"
FK16,56.1911,-4.05943,272298,701740,NN722017,"Doune, Argaty, Buchany, Deanston",Falkirk,99,73,1934,825,"FK8, FK15, FK9, FK17, FK7, FK11, PH6, G65, G68, FK12"
FK17,56.2405,-4.2195,262543,707545,NN625075,"Callander",Falkirk,161,132,3666,1625,"FK18, FK16, FK19, FK8, FK15, FK21, G64, G63, PH6, G21"
FK18,56.3157,-4.31675,256799,716111,NN567161,"Callander, Strathyre",Falkirk,9,8,234,96,"FK19, FK21, FK17, G63, G62, FK16, PH6, FK20, G61, PH17"
FK19,56.3728,-4.31124,257353,722453,NN573224,"Lochearnhead",Falkirk,34,28,535,234,"FK18, FK21, FK17, PH6, FK20, PH17, G63, FK16, G62, G61"
FK20,56.4074,-4.61056,239017,726964,NN390269,"Crianlarich, Luib, Tyndrum",Falkirk,28,23,413,151,"PA36, FK19, FK21, FK18, PH30, G83, PA33, PA26, G82, PH17"
FK21,56.4663,-4.32062,257125,732876,NN571328,"Killin, Ardeonaig, Auchmore, Clachaig, Glenlochay, Kinnell",Falkirk,56,54,936,429,"FK19, FK18, PH17, FK17, FK20, PH6, G63, PA36, G62, PH15"
FY1,53.8161,-3.04827,331081,436045,SD310360,"Blackpool",Blackpool,1732,978,33551,15326,"FY3, FY2, FY4, FY5, FY0, FY8, FY6, FY7, PR8, PR9"
FY2,53.8444,-3.04023,331656,439185,SD316391,"Bispham",Blackpool,693,551,24589,11126,"FY1, FY3, FY5, FY4, FY6, FY7, FY0, FY8, PR8, PR9"
FY3,53.8211,-3.02265,332775,436576,SD327365,"Layton, Marton, Staining",Blackpool,1026,782,32027,14341,"FY1, FY4, FY2, FY5, FY0, FY6, FY8, FY7, PR8, PR9"
FY4,53.792,-3.0305,332212,433346,SD322333,"Blackpool, Blackpool Airport, Marton, South Shore",Blackpool,1442,1101,44072,19728,"FY3, FY1, FY0, FY2, FY8, FY5, FY6, FY7, PR8, PR9"
FY5,53.8736,-3.02436,332747,442419,SD327424,"Thornton-Cleveleys",Wyre,1461,1145,44800,20430,"FY7, FY2, FY6, FY3, FY1, FY4, FY0, FY8, PR8, PR9"
FY6,53.865,-2.98045,335621,441422,SD356414,"Poulton-Le-Fylde, Hambleton, Knott End-on-Sea, Preesall, Singleton",Wyre,1017,800,27751,12497,"FY5, FY2, FY3, FY7, FY1, FY4, FY0, FY8, PR9, PR4"
FY7,53.9165,-3.02549,332742,447193,SD327471,"Fleetwood",Wyre,862,651,25939,11173,"FY5, FY2, FY6, FY3, FY1, FY4, FY0, FY8, LA3, PR8"
FY8,53.7505,-3.00669,333715,428707,SD337287,"Lytham St. Annes, Moss Side",Fylde,1833,1278,43864,21365,"FY0, FY4, FY3, FY1, PR8, FY2, PR9, FY6, FY5, PR4"
G1,55.8604,-4.24911,259330,665311,NS593653,"Merchant City",Glasgow,1220,370,7399,4131,"G2, G4, G58, G9, G80, G90, G5, G3, G22, G42"
G2,55.8635,-4.25593,258915,665669,NS589656,"Blythswood Hill",Glasgow,2191,543,2589,1506,"G58, G4, G1, G3, G5, G9, G80, G90, G22, G42"
G3,55.8663,-4.27029,258027,666010,NS580660,"Anderston, Finnieston, Garnethill, Park, Woodlands, Yorkhill",Glasgow,1057,453,17747,8713,"G2, G58, G4, G1, G9, G80, G20, G90, G5, G41"
G4,55.8681,-4.2516,259202,666172,NS592661,"Calton, Cowcaddens, Drygate, Kelvinbridge, Townhead, Woodlands, Woodside",Glasgow,630,324,12894,5669,"G2, G9, G80, G1, G90, G58, G3, G22, G5, G21"
G5,55.8477,-4.25395,258981,663907,NS589639,"Gorbals",Glasgow,745,339,10966,5858,"G58, G1, G2, G42, G4, G9, G80, G40, G90, G3"
