Postcode,Latitude,Longitude,Easting,Northing,Grid Reference,Town/Area,Region,Postcodes,Active postcodes,Population,Households,Nearby districts
AB10,57.1349,-2.11738,392994,804893,NJ929048,"Aberdeen city centre, Bridge of Dee, Mannofield",Aberdeen,896,675,21964,11517,"AB9, AB25, AB11, AB1, AB24, AB12, AB99, AB15, AB22, AB2"
AB11,57.1371,-2.09346,394442,805136,NJ944051,"Aberdeen city centre, Torry",Aberdeen,896,642,21237,10926,"AB10, AB99, AB9, AB25, AB24, AB12, AB1, AB15, AB23, AB22"
AB12,57.1034,-2.1098,393447,801386,NJ934013,"Aberdeen, Altens, Ardoe, Banchory Devenick, Blairs, Bridge of Dee, Cove Bay, Maryculter, Nigg, Portlethen",Aberdeen,1033,797,25414,10688,"AB99, AB10, AB9, AB1, AB11, AB25, AB24, AB15, AB22, AB2"
AB13,57.1124,-2.24337,385359,802409,NJ853024,"Milltimber",Aberdeen,109,86,2725,947,"AB14, AB15, AB32, AB1, AB16, AB21, AB12, AB10, AB99, AB39"
AB14,57.1034,-2.2727,383579,801414,NJ835014,"Peterculter, Upper Anguston",Aberdeen,166,142,4881,2162,"AB13, AB32, AB15, AB1, AB12, AB16, AB21, AB39, AB99, AB10"
AB15,57.1386,-2.16699,389992,805312,NJ899053,"Aberdeen, Bieldside, Craigiebuckler, Cults, Hazlehead, Kingswells, Mannofield, Milltimber",Aberdeen,1263,1068,35543,15330,"AB16, AB1, AB10, AB2, AB9, AB25, AB11, AB24, AB12, AB22"
AB16,57.1596,-2.15653,390631,807648,NJ906076,"Aberdeen, Mastrick, Northfield, Middlefield, Cornhill",Aberdeen,914,770,29238,12874,"AB2, AB15, AB25, AB24, AB1, AB9, AB22, AB10, AB11, AB21"
AB21,57.2081,-2.2007,387975,813054,NJ879130,"Aberdeen, Blackburn, Bucksburn, Dyce, Fintray, Kinellar, Newmachar, Whiterashes",Aberdeen,930,776,22181,9650,"AB16, AB2, AB22, AB15, AB23, AB24, AB13, AB25, AB1, AB9"
AB22,57.1865,-2.11967,392865,810638,NJ928106,"Aberdeen, Bridge of Don, Danestone, Grandholm, Persley",Aberdeen,376,311,16311,6978,"AB24, AB2, AB25, AB9, AB23, AB10, AB16, AB11, AB1, AB12"
AB23,57.2083,-2.08982,394673,813062,NJ946130,"Aberdeen, Balmedie, Belhelvie, Bridge of Don, Potterton, Whitecairns",Aberdeen,411,315,11143,4517,"AB22, AB24, AB11, AB25, AB9, AB2, AB10, AB99, AB21, AB16"
AB25,57.1535,-2.11424,393188,806964,NJ931069,"Aberdeen city centre, Kittybrewster, Foresterhill, Rosemount, George Street",Aberdeen,627,480,18407,9634,"AB9, AB24, AB10, AB11, AB22, AB2, AB16, AB1, AB12, AB99"
AB30,56.8457,-2.47711,370995,772795,NO709727,"Laurencekirk",Aberdeenshire,358,314,7229,2935,"DD10, AB31, DD9, AB3, AB39, DD11, AB14, AB32, AB13, AB51"
AB31,57.0669,-2.50483,369486,797431,NO694974,"Banchory",Aberdeenshire,1055,647,15319,6096,"AB3, AB30, AB14, AB32, AB13, AB51, AB34, AB52, AB39, AB33"
AB32,57.1545,-2.31487,381050,807113,NJ810071,"Westhill",Aberdeenshire,429,362,12902,5011,"AB14, AB13, AB16, AB15, AB21, AB2, AB25, AB1, AB9, AB24"
AB33,57.226,-2.73698,355600,815270,NJ555152,"Alford",Aberdeenshire,310,271,5273,2180,"AB34, AB52, AB54, AB3, AB5, AB36, AB31, AB51, AB32, AB55"
AB34,57.0927,-2.80993,351019,800481,NJ510004,"Aboyne",Aberdeenshire,296,269,5387,2309,"AB33, AB3, AB31, AB36, AB35, AB54, AB52, DD9, AB5, AB14"
AB35,57.039,-3.14433,330656,794794,NO306947,"Ballater",Aberdeenshire,201,164,2624,1217,"AB36, AB34, PH12, PH11, AB37, AB38, IV33, IV34, AB33, AB3"
AB37,57.3308,-3.35294,318642,827505,NJ186275,"Ballindalloch",Moray,95,87,1534,678,"IV35, IV34, PH26, AB38, IV33, IV30, PH25, AB36, IV31, PH24"
AB38,57.4854,-3.22714,326526,844571,NJ265445,"Aberlour",Moray,183,163,4660,2009,"IV33, IV34, IV35, IV32, IV30, AB37, IV31, AB55, AB36, AB54"
AB39,56.978,-2.21703,386907,787442,NO869874,"Stonehaven, Newtonhill",Aberdeenshire,599,528,17645,7238,"AB13, AB14, AB15, AB1, AB12, AB16, AB21, AB99, AB10, AB2"
AB41,57.3718,-2.11687,393070,831266,NJ930312,"Ellon",Aberdeenshire,1180,815,20837,8517,"AB4, AB22, AB23, AB24, AB25, AB2, AB9, AB10, AB21, AB16"
AB42,57.5016,-1.88818,406800,845715,NK068457,"Hatton, St. Fergus",Aberdeenshire,2397,1230,33730,14367,"AB4, AB43, AB41, AB23, AB22, AB53, AB24, AB11, AB25, AB9"
AB43,57.6578,-2.04487,397422,863100,NJ974631,"Crimond",Aberdeenshire,1445,760,23998,10103,"AB4, AB42, AB41, AB44, AB53, AB23, AB45, AB22, AB24, AB11"
AB44,57.6682,-2.49318,370678,864365,NJ706643,"Macduff",Aberdeenshire,156,145,4009,1794,"AB45, AB53, AB5, AB56, AB52, AB43, AB54, AB51, AB4, AB31"
AB45,57.6521,-2.567,366259,862606,NJ662626,"Banff",Aberdeenshire,685,616,11130,4900,"AB44, AB5, AB53, AB52, AB56, AB54, AB51, AB43, AB55, AB4"
AB51,57.2879,-2.40476,375700,821992,NJ757219,"Inverurie",Aberdeenshire,1733,1178,34643,14152,"AB32, AB53, AB52, AB21, AB14, AB31, AB13, AB41, AB16, AB2"
AB52,57.3421,-2.60258,363829,828114,NJ638281,"Insch",Aberdeenshire,260,248,4758,1952,"AB5, AB33, AB51, AB3, AB54, AB45, AB31, AB53, AB44, AB34"
AB53,57.5344,-2.40719,375718,849435,NJ757494,"Turriff",Aberdeenshire,1075,685,12613,5325,"AB44, AB51, AB45, AB4, AB5, AB52, AB54, AB41, AB32, AB43"
AB54,57.4657,-2.75604,354746,841966,NJ547419,"Aberchirder, Cabrach, Cairnie, Forgue, Gartly, Glass, Kennethmont, Lumsden, Rhynie, Rothiemay",Aberdeenshire,1052,656,11367,5003,"AB5, AB33, AB52, AB55, AB56, AB45, AB53, AB34, AB44, AB38"
AB55,57.5324,-2.97563,341680,849558,NJ416495,"Keith",Moray,747,426,9307,4097,"AB56, IV33, IV32, AB54, AB38, IV34, AB5, AB36, IV35, IV30"
AB56,57.6735,-2.91919,345272,865219,NJ452652,"Buckie",Moray,1014,639,14825,6515,"AB55, IV32, AB54, AB45, IV31, IV30, AB44, IV33, AB5, AB38"
AL1,51.7487,-0.319472,516110,206892,TL161068,"St Albans",St Albans,2017,1206,36291,15082,"AL2, AL4, WD7, AL3, AL5, AL10, AL9, WD6, WD25, WD2"
AL2,51.7223,-0.331038,515379,203938,TL153039,"St Albans, Bricket Wood, Colney Street, Frogmore, London Colney, Napsbury, Park Street, Potters Crouch, Chiswell Green",St Albans,978,723,23335,9380,"AL1, WD7, AL4, AL3, WD25, WD2, WD5, WD23, AL5, WD6"
AL3,51.7754,-0.366601,512791,209787,TL127097,"St Albans, Childwickbury, Flamstead, Gorhambury, Markyate, Porters Wood, Redbourn, Sandridge",St Albans,1301,950,28025,11197,"AL5, AL1, AL4, AL2, HP2, WD25, WD2, WD5, WD23, HP1"
AL4,51.7713,-0.295994,517672,209443,TL176094,"St Albans, Colney Heath, London Colney, Jersey Farm, Marshalswick, Oaklands, Sandridge, Smallford, Tyttenhanger, Wheathampstead",St Albans,1055,780,27221,10792,"AL1, AL3, AL10, AL2, AL5, WD7, AL8, AL9, AL7, WD6"
AL5,51.8146,-0.35151,513733,214170,TL137141,"Harpenden",St Albans,1546,1063,30486,11672,"AL3, AL1, AL4, AL2, LU2, LU1, AL8, HP2, AL6, WD7"
AL6,51.8299,-0.199444,524173,216120,TL241161,"Welwyn, Ayot St Peter, Ayot St Lawrence, Digswell, Rabley Heath, Tewin",Welwyn Hatfield,656,507,11181,4502,"AL8, AL7, SG3, SG1, AL9, SG2, AL10, SG14, EN6, AL4"
AL7,51.7986,-0.189303,524958,212656,TL249126,"Welwyn Garden City",Welwyn Hatfield,1423,907,33974,14170,"AL8, AL6, AL9, SG3, AL10, SG14, EN6, SG2, SG1, SG13"
AL8,51.8034,-0.210326,523495,213154,TL234131,"Welwyn Garden City, Lemsford",Welwyn Hatfield,598,425,13366,5648,"AL7, AL6, AL10, AL9, SG3, AL4, SG1, SG14, SG2, EN6"
AL9,51.7469,-0.201694,524245,206885,TL242068,"Hatfield, Brookmans Park, Essendon, North Mymms",Welwyn Hatfield,613,431,10641,4342,"AL10, AL7, AL8, EN6, AL6, EN5, AL4, AL1, SG3, EN4"
AL10,51.7609,-0.231256,522167,208392,TL221083,"Hatfield",Welwyn Hatfield,1161,789,35391,12424,"AL9, AL8, AL4, AL7, AL1, AL6, EN6, AL2, SG3, WD6"
B1,52.4796,-1.90779,406360,286856,SP063868,"Birmingham City Centre, Ladywood",Birmingham ,712,298,8514,4526,"B3, B2, B4, B5, B19, B18, B15, B16, B99, B6"
B2,52.4863,-1.89732,407070,287603,SP070876,"Birmingham City Centre, Ladywood",Birmingham ,860,423,655,473,"B4, B3, B99, B5, B1, B19, B6, B7, B18, B12"
B3,52.4823,-1.90289,406692,287157,SP066871,"Birmingham City Centre, Ladywood",Birmingham ,701,207,2226,1406,"B1, B2, B4, B5, B19, B99, B18, B15, B6, B16"
B4,52.4838,-1.89374,407313,287325,SP073873,"Birmingham City Centre, Ladywood",Birmingham ,466,197,4337,465,"B2, B3, B99, B5, B1, B19, B6, B7, B12, B18"
B5,52.4722,-1.89683,407105,286034,SP071860,"Digbeth, Highgate, Lee Bank",Birmingham,880,381,12156,5139,"B2, B4, B3, B1, B12, B99, B15, B19, B16, B6"
B6,52.5025,-1.88685,407778,289405,SP077894,"Aston",Birmingham,870,423,19507,5886,"B99, B7, B19, B4, B2, B3, B5, B20, B44, B1"
B7,52.4938,-1.87438,408626,288439,SP086884,"Nechells",Birmingham,436,270,8554,3444,"B6, B99, B4, B2, B19, B8, B9, B3, B12, B5"
B8,52.49,-1.84277,410773,288021,SP107880,"Washwood Heath, Ward End, Saltley",Birmingham,777,578,42278,11987,"B9, B10, B7, B24, B25, B23, B11, B6, B4, B99"
B9,52.4781,-1.85284,410092,286696,SP100866,"Bordesley Green",Birmingham,774,418,24915,7548,"B10, B8, B11, B7, B25, B4, B12, B5, B23, B2"
B10,52.4701,-1.85328,410064,285806,SP100858,"Small Heath",Birmingham,456,315,26004,7108,"B9, B11, B8, B25, B12, B7, B5, B28, B27, B4"
B11,52.4554,-1.85984,409621,284170,SP096841,"Sparkhill, Tyseley",Birmingham,1029,611,44391,12602,"B10, B12, B9, B25, B13, B28, B27, B8, B7, B5"
B12,52.4609,-1.88253,408079,284779,SP080847,"Balsall Heath, Sparkbrook, Highgate",Birmingham,747,456,20548,6649,"B5, B13, B11, B4, B10, B2, B7, B3, B1, B6"
B13,52.4351,-1.8826,408078,281909,SP080819,"Moseley, Billesley",Birmingham,1092,670,37672,15392,"B14, B12, B11, B28, B47, B5, B30, B4, B10, B29"
B14,52.4188,-1.89026,407560,280095,SP075800,"Kings Heath, Yardley Wood, Brandwood, Druids Heath, Warstock",Birmingham,1033,778,43099,18063,"B13, B47, B30, B22, B12, B28, B5, B38, B11, B4"
B15,52.468,-1.92348,405295,285565,SP052855,"Edgbaston, Lee Bank",Birmingham,837,472,17872,6220,"B16, B18, B1, B5, B3, B2, B4, B19, B17, B12"
B16,52.4754,-1.9323,404695,286387,SP046863,"Edgbaston, Ladywood",Birmingham,1143,498,23619,10305,"B15, B18, B1, B21, B3, B5, B17, B2, B4, B19"
B17,52.4615,-1.96293,402616,284839,SP026848,"Harborne",Birmingham,797,554,25625,10999,"B66, B67, B29, B32, B16, B15, B68, B31, B21, B18"
B18,52.4915,-1.92254,405356,288179,SP053881,"Winson Green, Hockley",Birmingham,898,439,16739,6389,"B19, B15, B20, B16, B1, B21, B3, B2, B99, B4"
B19,52.4963,-1.90616,406468,288714,SP064887,"Lozells, Newtown, Birchfield",Birmingham,681,448,20204,6606,"B99, B3, B1, B2, B18, B4, B6, B20, B5, B7"
B20,52.5134,-1.91885,405604,290615,SP056906,"Birchfield, Handsworth Wood Perry Barr",Birmingham,751,529,34752,11191,"B18, B21, B19, B42, B99, B6, B43, B1, B3, B2"
B21,52.5051,-1.93634,404418,289691,SP044896,"Handsworth",Birmingham,778,433,29626,9638,"B20, B18, B16, B19, B66, B15, B43, B99, B6, B1"
B23,52.5276,-1.85172,410157,292202,SP101922,"Erdington, Short Heath",Birmingham,1232,826,42858,18745,"B24, B73, B8, B9, B44, B72, B7, B10, B42, B74"
B24,52.5196,-1.82891,411706,291316,SP117913,"Erdington, Tyburn",Birmingham,760,571,28280,11680,"B23, B72, B35, B8, B73, B25, B36, B76, B9, B34"
B25,52.4616,-1.826,411919,284864,SP119848,"Yardley",Birmingham,495,266,15861,5983,"B27, B26, B10, B11, B9, B8, B28, B33, B12, B90"
B26,52.4607,-1.79288,414170,284770,SP141847,"Sheldon, Yardley",Birmingham,743,569,32458,13394,"B33, B25, B92, B27, B34, B36, B91, B35, B37, B10"
B27,52.4458,-1.82377,412075,283107,SP120831,"Acocks Green",Birmingham,543,433,25331,10206,"B25, B28, B11, B26, B90, B10, B92, B9, B8, B13"
B28,52.4278,-1.84318,410760,281102,SP107811,"Hall Green",Birmingham,831,587,30345,10982,"B27, B90, B11, B13, B25, B10, B14, B9, B8, B12"
B29,52.4377,-1.94563,403793,282193,SP037821,"Selly Oak, Bournbrook, Selly Park, Weoley Castle, California",Birmingham,1092,791,42615,15306,"B30, B17, B22, B38, B16, B15, B31, B32, B13, B14"
B30,52.4212,-1.9281,404987,280359,SP049803,"Bournville, Cotteridge, Stirchley",Birmingham,879,607,29541,12757,"B22, B38, B29, B14, B15, B31, B16, B13, B17, B18"
B31,52.4092,-1.97309,401928,279022,SP019790,"Northfield",Birmingham,1454,1132,53794,22747,"B22, B38, B45, B29, B30, B17, B32, B48, B67, B66"
B32,52.4509,-1.99449,400471,283660,SP004836,"Woodgate, Bartley Green, Quinton, California",Birmingham,1090,762,38357,16209,"B68, B17, B62, B67, B29, B31, B66, B63, B45, B70"
B33,52.4807,-1.78795,414498,286996,SP144869,"Kitts Green, Stechford",Birmingham,917,692,34483,13699,"B34, B26, B36, B35, B37, B25, B92, B8, B76, B9"
B34,52.4957,-1.78168,414919,288666,SP149886,"Shard End, Buckland End",Birmingham,384,326,18941,8112,"B36, B33, B35, B26, B37, B76, B8, B92, B24, B25"
B35,52.5173,-1.78998,414349,291067,SP143910,"Castle Vale",Birmingham,435,284,9931,4223,"B36, B76, B34, B33, B24, B26, B72, B23, B8, B75"
B36,52.5045,-1.77998,415032,289645,SP150896,"Castle Bromwich, Smith's Wood",Solihull,716,576,35132,13822,"B34, B35, B33, B76, B26, B24, B37, B92, B8, B46"
B37,52.4784,-1.74181,417633,286750,SP176867,"Chelmsley Wood, Marston Green, Kingshurst, Fordbridge",Solihull,917,731,35875,15370,"B40, B33, B34, B36, B26, B46, B92, B35, B93, B25"
B38,52.401,-1.93401,404587,278111,SP045781,"Kings Norton",Birmingham,584,471,21061,8859,"B22, B30, B31, B29, B14, B48, B47, B16, B15, B13"
B40,52.4587,-1.72503,418781,284563,SP187845,"National Exhibition Centre, Birmingham International Airport, Bickenhill",Solihull,26,13,9,2,"B37, B26, B92, B46, B33, B93, B34, B91, B36, B25"
B42,52.5347,-1.90468,406563,292986,SP065929,"Perry Barr, Great Barr, Hamstead",Birmingham,733,402,24262,9307,"B44, B20, B43, B19, B99, B6, B3, B2, B1, B23"
B43,52.5476,-1.92824,404963,294419,SP049944,"Great Barr, Hamstead, Pheasey",Birmingham,669,548,28796,11795,"B42, B20, B44, B21, WS5, B18, WS9, B19, B71, B16"
B44,52.545,-1.88565,407852,294133,SP078941,"Perry Barr, Kingstanding, Great Barr",Birmingham,795,635,37447,15044,"B42, B6, B43, B23, B99, B73, B7, B20, B74, B19"
B45,52.3885,-2.00843,399523,276719,SO995767,"Rednal, Rubery",Birmingham,916,704,30273,12810,"B31, B32, B38, B48, B68, B62, B22, B61, B60, B29"
B46,52.5071,-1.69761,420621,289954,SP206899,"Water Orton, Coleshill",North Warwickshire,663,483,12188,5194,"B37, B40, B36, B34, B35, B33, B78, B76, B77, B26"
B47,52.3887,-1.88118,408183,276748,SP081767,"Hollywood, Wythall",Bromsgrove Worcestershire,293,242,9560,4132,"B14, B13, B38, B90, B22, B12, B28, B30, B11, B5"
B48,52.3568,-1.95165,403390,273194,SP033731,"Alvechurch",Bromsgrove Worcestershire,244,208,5685,2309,"B97, B38, B31, B22, B29, B30, B45, B98, B47, B96"
B49,52.2173,-1.86743,409154,257684,SP091576,"Alcester",Stratford-on-Avon,506,371,10097,4440,"B50, B80, B96, B98, B95, B97, WR12, CV37, WR11, B47"
B50,52.1696,-1.85662,409903,252380,SP099523,"Alcester",Stratford-on-Avon,226,206,5517,2235,"B49, WR12, WR11, B80, CV37, B96, GL55, B98, B95, B97"
B60,52.3236,-2.05,396689,269501,SO966695,"Bromsgrove",Bromsgrove,1162,849,27178,11377,"B61, B45, B97, B48, WR7, B63, B62, B98, B96, WR9"
B61,52.3441,-2.06747,395501,271782,SO955717,"Bromsgrove",Bromsgrove,855,725,24316,10046,"B60, B45, B63, B48, B64, B62, DY9, WR7, B97, B31"
B62,52.4599,-2.03721,397569,284662,SO975846,"Halesowen",Dudley,915,578,24112,10054,"B65, B63, B64, B32, B69, B68, B17, DY2, B67, DY4"
B63,52.4531,-2.06737,395519,283907,SO955839,"Halesowen",Dudley,1018,781,36590,15599,"B64, B62, B65, DY2, DY9, B32, DY5, DY1, B69, DY4"
B64,52.4724,-2.06909,395404,286054,SO954860,"Cradley Heath",Sandwell,631,470,16616,6986,"B63, B65, DY2, B62, DY5, DY1, B69, DY4, B68, DY9"
B65,52.4828,-2.04345,397146,287209,SO971872,"Rowley Regis",Sandwell,641,512,23581,9730,"B62, B64, B69, B68, B63, DY2, DY4, B67, B70, B32"
B66,52.4936,-1.96587,402414,288410,SP024884,"Smethwick, Bearwood",Sandwell,950,568,21491,7363,"B67, B17, B21, B18, B68, B16, B19, B70, B71, B20"
B67,52.4877,-1.97729,401639,287754,SP016877,"Smethwick, Bearwood",Sandwell,751,525,29853,11466,"B66, B68, B17, B32, B16, B70, B21, B18, B71, B69"
B68,52.4801,-2.00183,399973,286908,SO999869,"Oldbury",Sandwell,688,581,30924,12394,"B67, B32, B70, B65, B69, B66, B62, B17, B71, B16"
B69,52.5028,-2.02546,398369,289433,SO983894,"Oldbury",Sandwell,1077,710,29011,11505,"B65, B70, B68, B62, DY4, WS10, DY2, B67, B71, B66"
B70,52.5198,-2.00267,399916,291324,SO999913,"West Bromwich",Sandwell,1363,830,27772,10542,"B71, B69, B68, B67, WS10, B66, DY4, WS2, B32, B65"
B71,52.5348,-1.9901,400769,292993,SP007929,"West Bromwich",Sandwell,790,678,30934,12543,"B70, WS1, WS10, B67, WS5, B66, WS2, B68, DY4, B69"
B72,52.5545,-1.82364,412054,295199,SP120951,"Sutton Coldfield town centre, Maney, Wylde Green",Birmingham,374,236,9660,3951,"B73, B75, B24, B76, B23, B74, B35, B44, B8, B36"
B73,52.5593,-1.83767,411102,295730,SP111957,"Boldmere, New Oscott, Wylde Green",Birmingham,1021,554,23071,9628,"B72, B74, B75, B23, B24, B44, B76, B8, B35, B42"
B74,52.5823,-1.85727,409768,298286,SP097982,"Four Oaks, Mere Green, Little Aston, Streetly",Birmingham,972,763,32012,13302,"B73, B75, B23, B72, B44, WS9, B24, B42, B76, B7"
B75,52.5778,-1.81122,412890,297793,SP128977,"Sutton Trinity, Falcon Lodge, Rectory",Birmingham,836,645,26863,11019,"B72, B73, B74, B76, B24, B35, B23, WS14, B36, B44"
B76,52.5447,-1.7899,414345,294115,SP143941,"Walmley",Birmingham,1072,524,21509,9175,"B35, B72, B36, B75, B34, B73, B24, B33, B23, B26"
B77,52.6203,-1.67172,422321,302554,SK223025,"Tamworth",Tamworth,1413,974,57219,22836,"B78, B79, B46, CV9, B75, WS14, B76, DE13, B37, B40"
B78,52.6066,-1.6751,422100,301029,SK220010,"Tamworth",Tamworth,717,613,24227,9885,"B77, B79, B46, CV9, B75, B76, B37, B40, B72, WS14"
B79,52.6481,-1.68231,421591,305643,SK215056,"Tamworth",Tamworth,850,669,22302,9745,"B77, B78, WS14, B46, DE13, WS13, CV9, B75, DE14, DE12"
B80,52.279,-1.89717,407113,264544,SP071645,"Studley",Stratford-on-Avon,253,209,7055,2994,"B98, B97, B96, B49, B95, B47, B48, B14, B50, B38"
B90,52.4012,-1.82608,411930,278146,SP119781,"Shirley, Wythall, Majors Green, Dickens Heath",Solihull,1472,1048,45652,18910,"B28, B27, B91, B25, B47, B14, B94, B92, B11, B13"
B91,52.414,-1.7807,415013,279578,SP150795,"Olton, Solihull",Solihull,1409,847,33280,13518,"B92, B90, B26, B93, B94, B33, B27, B28, B34, B36"
B92,52.4353,-1.77432,415440,281948,SP154819,"Olton, Solihull",Solihull,905,721,36119,15211,"B91, B26, B33, B27, B34, B40, B36, B37, B28, B25"
B93,52.3831,-1.74212,417650,276149,SP176761,"Knowle, Dorridge",Solihull,855,533,19505,7944,"B91, B94, B92, B40, B37, B90, B26, B95, B33, B27"
B94,52.353,-1.79094,414336,272791,SP143727,"Olton, Solihull",Solihull,421,336,7298,2979,"B91, B95, B93, B90, B92, B26, B27, B47, B28, B33"
B95,52.2871,-1.78055,415066,265463,SP150654,"Henley-in-Arden",Stratford-on-Avon,412,325,6000,2771,"B94, B80, B91, B93, B98, B92, B49, B90, CV37, B97"
B96,52.2549,-1.95955,402858,261859,SP028618,"Redditch",Redditch,236,211,4968,2181,"B97, B80, B98, B48, B49, B60, WR7, B31, B38, B45"
B97,52.3033,-1.94973,403525,267243,SP035672,"Redditch",Redditch,1258,795,33402,13653,"B98, B48, B96, B80, B38, B60, B31, B22, B29, B30"
B98,52.3037,-1.91601,405824,267290,SP058672,"Redditch",Redditch,1128,814,49783,20137,"B97, B80, B48, B96, B38, B47, B22, B30, B49, B14"
BA1,51.3888,-2.36019,375033,165590,ST750655,"Bath",Bath and North East Somerset,2551,1558,40612,18710,"BA2, BA15, BS31, BS30, BA11, SN13, BA3, BS15, BS37, BS17"
BA2,51.362,-2.37621,373903,162615,ST739626,"Bath",Bath and North East Somerset,2692,2164,73927,29525,"BA1, BA15, BA3, BS31, BA11, BS30, BS39, BS15, BS18, BA14"
BA3,51.2856,-2.4493,368762,154147,ST687541,"Radstock, Midsomer Norton, Holcombe, Coleford",Bath and North East Somerset,1944,1253,34598,13970,"BS39, BA2, BS31, BA11, BA10, BS30, BA1, BA4, BS15, BS18"
BA4,51.1746,-2.5333,362815,141842,ST628418,"Shepton Mallet",Mendip,997,829,17781,7448,"BA7, BA10, BS39, BA5, BA3, BA6, BA9, BS18, DT9, BA16"
BA5,51.2116,-2.65485,354354,146025,ST543460,"Wells",Mendip,983,766,17731,7901,"BA6, BA4, BA16, BS40, BS28, BS27, TA11, BS41, BS18, BS39"
BA6,51.1431,-2.70941,350470,138443,ST504384,"Glastonbury",Mendip,757,553,12840,5634,"BA16, TA11, BA5, BS28, BS27, TA15, BA4, TA7, BS40, TA10"
BA7,51.0894,-2.51854,363780,132360,ST637323,"Castle Cary",South Somerset,227,187,3655,1663,"BA10, BA4, BA9, DT9, BA8, TA11, BA22, BA6, BS39, BA21"
BA8,51,-2.41073,371275,122370,ST712223,"Templecombe",South Somerset,231,207,4165,1793,"BA9, DT10, BA10, SP8, DT9, BA7, SP7, BA22, BA21, DT2"
BA9,51.0577,-2.41015,371351,128786,ST713287,"Wincanton",South Somerset,463,371,7201,3173,"BA8, BA10, BA7, SP8, DT10, DT9, BA4, BA11, BA3, SP7"
BA10,51.1123,-2.44728,368786,134873,ST687348,"Bruton",South Somerset,199,177,3843,1414,"BA9, BA7, BA4, BA8, BA3, SP8, DT9, BA11, DT10, BA6"
BA11,51.2376,-2.32633,377315,148763,ST773487,"Frome",Mendip,1437,1141,32633,13874,"BA13, BA3, BA2, BA15, BA1, BA12, BA14, SP8, BA10, BA9"
BA12,51.1743,-2.18742,386994,141690,ST869416,"Warminster",Wiltshire,1363,1118,28544,12460,"BA13, BA14, SP7, BA11, SP8, SN12, BA15, SP3, SN13, SN14"
BA13,51.263,-2.18487,387197,151554,ST871515,"Westbury",Wiltshire,772,611,20306,8488,"BA14, BA12, SN12, BA15, BA11, SN13, SN14, SP7, SN10, BA3"
BA14,51.319,-2.20283,385961,157785,ST859577,"Trowbridge",Wiltshire,1751,1343,48041,20026,"BA13, BA15, SN13, SN12, SN14, BA12, BA11, BA2, BA1, SN10"
BA15,51.3484,-2.26218,381837,161068,ST818610,"Bradford-on-Avon",Wiltshire,647,475,12995,5820,"BA14, BA2, SN13, BA1, SN12, BA13, BA11, SN14, GL9, BA12"
BA16,51.1265,-2.74323,348085,136620,ST480366,"Street",Mendip,435,373,13011,5259,"BA6, TA11, BS28, BA5, BS27, TA10, TA7, TA12, TA14, TA15"
BA20,50.939,-2.64274,354935,115703,ST549157,"Yeovil",South Somerset,788,499,11240,4935,"BA21, BA22, TA15, TA14, DT9, TA12, TA13, TA16, TA11, TA18"
BA21,50.9511,-2.63381,355574,117043,ST555170,"Yeovil",South Somerset,894,768,33314,14210,"BA22, BA20, TA15, TA14, DT9, TA12, TA13, TA11, TA16, TA18"
BA22,50.9686,-2.63721,355352,118991,ST553189,"Yeovil",South Somerset,876,771,18102,7227,"BA21, BA20, TA15, TA14, TA12, DT9, TA11, TA13, TA16, TA18"
BB1,53.7552,-2.46573,369390,428860,SD693288,"Blackburn, Bank Hey, Belthorn, Blackamoor, Clayton-le-Dale, Guide, Knuzden, Mellor, Ramsgreave, Rishton, Salesbury, Shadsworth, Sunnybower, Whitebirk, Wilpshire",Blackburn with Darwen,1905,1285,66805,24188,"BB0, BB2, BB3, BB5, BB6, BL7, BL1, BB7, PR0, BL3"
BB2,53.7418,-2.498,367251,427383,SD672273,"Blackburn, Beardwood, Balderstone, Cherry Tree, Feniscowles, Mellor, Mellor Brook, Mill Hill, Pleasington, Witton, Holly Tree and Griffin",Blackburn with Darwen,2052,1354,59842,24112,"BB0, BB1, BB3, BB5, BB6, BL7, BL6, PR6, PR0, BL5"
BB3,53.6978,-2.46624,369314,422474,SD693224,"Darwen, Bank Fold, Eccleshill, Hoddlesden, Lower Darwen, Pickup Bank, Tockholes",Blackburn with Darwen,1170,879,34200,14813,"BB0, BB1, BB2, BL7, BL1, BB5, BB6, BL3, BL11, BL2"
BB4,53.7034,-2.29113,380878,423035,SD808230,"Acre, Bent Gate, Haslingden, Helmshore, Rawtenstall",Rossendale,1794,1323,41140,17390,"BL0, OL13, BB12, BL9, BB11, BB5, BL8, M45, BB10, BB3"
BB5,53.7545,-2.37229,375550,428746,SD755287,"Accrington, Altham, Baxenden, Church, Clayton-le-Moors, Huncoat, Oswaldtwistle, Rising Bridge",Hyndburn,2068,1532,61420,25822,"BB6, BB0, BB1, BB12, BB4, BB7, BB2, BB3, BB11, BL0"
BB6,53.8039,-2.4156,372727,434258,SD727342,"Dinckley, Great Harwood, Langho",Hyndburn,699,361,14602,6252,"BB5, BB7, BB1, BB0, BB12, BB2, BB3, BL7, BB11, BB10"
BB7,53.8718,-2.3891,374513,441802,SD745418,"Clitheroe, Barrow, Chatburn, Dunsop Bridge, Gisburn, Hurst Green, Pendleton, Sabden, Slaidburn, Waddington, Whalley, Whitewell, Wiswell",Ribble Valley,1417,1157,31641,13509,"BB6, BB5, BB12, BB1, BB0, BB9, BB11, BB8, BB2, BB10"
BB8,53.8792,-2.16807,389049,442569,SD890425,"Colne, Foulridge, Laneshaw Bridge, Trawden, Winewall, Wycoller",Pendle,1512,767,23032,10295,"BB18, BB94, BB9, BB10, BB11, BB12, OL13, BD23, BB7, OL14"
BB9,53.837,-2.21583,385894,437882,SD858378,"Nelson, Barrowford, Blacko, Brierfield, Higherford, Roughlee",Pendle,1824,1360,44588,17604,"BB10, BB11, BB8, BB12, BB18, OL13, BB94, BB7, BB4, BB6"
BB10,53.7994,-2.22166,385498,433700,SD854336,"Burnley, Cliviger, Reedley, Worsthorne",Burnley,1128,873,37183,15694,"BB9, BB11, BB12, OL13, BB8, BB18, BB4, BB5, BB94, BB6"
BB11,53.7848,-2.25077,383575,432082,SD835320,"Burnley",Burnley,1422,827,22428,9909,"BB10, BB12, BB9, BB4, OL13, BB5, BB8, BB6, BL0, BB18"
BB12,53.802,-2.28895,381067,434005,SD810340,"Burnley, Barley, Fence, Higham, Padiham, Read, Simonstone, Wheatley Lane",Burnley,1202,955,34620,14926,"BB11, BB10, BB4, BB9, BB6, BB5, BB7, BL0, OL13, BB8"
BB18,53.915,-2.17253,388765,446553,SD887465,"Barnoldswick, Earby, Kelbrook, Salterforth, Sough",Pendle,663,563,17063,7501,"BB94, BB8, BB9, BB10, BD23, BB11, BB12, BD20, OL13, BB7"
BD1,53.7973,-1.75431,416281,433471,SE162334,"Bradford city centre, Little Germany",Bradford ,1569,511,3790,1855,"BD99, BD5, BD3, BD8, BD98, BD2, BD7, BD9, BD4, BD18"
BD2,53.8141,-1.73627,417462,435345,SE174353,"Eccleshill, Fagley",Bradford,843,696,29799,11728,"BD3, BD10, BD98, BD1, BD99, BD4, BD9, BD18, BD5, BD8"
BD3,53.7979,-1.72996,417885,433544,SE178335,"Barkerend, Bradford Moor, Thornbury",Bradford,897,579,33336,9623,"BD2, BD1, BD4, BD99, BD10, BD5, BD8, BD98, LS28, BD7"
BD4,53.7768,-1.72164,418442,431198,SE184311,"Bierley, Bowling, East Bierley, Laisterdyke, Tong, Tong Street, Tyersal",Bradford,1278,951,31147,12600,"BD3, BD5, BD2, BD1, BD99, BD19, BD10, BD7, BD11, BD12"
BD5,53.7793,-1.75835,416022,431468,SE160314,"Bankfoot, Little Horton, West Bowling",Bradford,1023,636,32021,10706,"BD99, BD1, BD7, BD12, BD4, BD6, BD8, BD98, BD3, BD2"
BD6,53.7649,-1.78478,414285,429860,SE142298,"Buttershaw, Wibsey",Bradford,903,729,29771,12154,"BD7, BD12, BD8, BD5, BD9, BD14, BD99, BD1, HD6, BD98"
BD7,53.7842,-1.78099,414528,432008,SE145320,"Great Horton, Lidget Green",Bradford,904,614,35214,10861,"BD8, BD6, BD5, BD99, BD9, BD14, BD1, BD98, BD18, BD12"
BD8,53.8014,-1.78063,414546,433922,SE145339,"Girlington, Manningham, Lower Grange",Bradford,929,625,31893,9700,"BD7, BD9, BD99, BD1, BD98, BD18, BD6, BD97, BD5, BD3"
BD9,53.8115,-1.78812,414049,435044,SE140350,"Frizinghall, Heaton",Bradford,713,531,28532,7953,"BD8, BD97, BD98, BD18, BD7, BD99, BD1, BD6, BD15, BD17"
BD10,53.8309,-1.72621,418118,437216,SE181372,"Apperley Bridge, Eccleshill, Greengates, Idle, Thackley",Bradford,891,694,25694,10790,"BD2, BD3, BD18, BD98, LS20, BD17, BD4, BD1, BD99, LS19"
BD11,53.7499,-1.67918,421254,428217,SE212282,"Birkenshaw, Drighlington",Kirklees,351,285,10971,4713,"WF16, BD19, WF15, LS28, BD4, WF17, LS27, WF14, BD12, WF13"
