Postcode,Latitude,Longitude,Easting,Northing,Grid Reference,Town/Area,Region,Postcodes,Active postcodes,Population,Households,Nearby districts
LE13,52.7666,-0.883846,475407,319362,SK754193,"Melton Mowbray",Leicester,826,609,27092,11588,"LE14, NG13, LE7, LE15, LE16, LE94, LE12, NG12, LE5, LE11"
LE14,52.7826,-0.895268,474609,321130,SK746211,"Brooksby, Harby, Hoby, Ragdale, Rotherby, Scalford, Somerby, Stonesby, Waltham on the Wolds, Wymondham",Melton,784,636,17268,7294,"LE13, NG13, LE7, NG12, LE16, LE94, LE12, LE15, LE11, LE5"
LE15,52.6593,-0.706515,487586,307627,SK875076,"Empingham, Manton, Thistleton, Uppingham, Whissendine, Langham",Rutland,1403,1100,32521,12955,"NN17, NN18, PE9, NN14, NN16, NN15, NG33, LE13, LE14, NG31"
LE16,52.4853,-0.898798,474876,288056,SP748880,"East Langton, Hallaton, Market Harborough, Medbourne, Braybrooke",Harborough,1306,998,34458,14327,"LE94, NN18, NN6, NN17, NN2, NN1, NN99, NN4, NN14, NN5"
LE17,52.4676,-1.18172,455686,285832,SP556858,"Leire, Lutterworth, Swinford, Bitteswell, Ullesthorpe",Leicester,974,779,20773,8495,"LE95, LE19, LE3, LE8, LE18, CV21, LE9, LE2, LE41, CV22"
LE18,52.5834,-1.11158,460293,298769,SP602987,"Wigston",Leicester,961,731,32873,13419,"LE8, LE2, LE21, LE87, LE1, LE5, LE4, LE41, LE95, LE19"
LE19,52.5858,-1.21304,453415,298956,SP534989,"Narborough, Enderby",Leicester,620,475,14788,6195,"LE95, LE9, LE3, LE18, LE2, LE41, LE87, LE8, LE1, LE21"
LE65,52.7485,-1.46988,435881,316896,SK358168,"Ashby-de-la-Zouch, Boundary, Calke, Smisby, Willesley, Worthington",Leicester,651,472,14162,5936,"LE55, DE12, DE11, DE73, LE67, LE6, DE24, DE99, DE1, DE23"
LE67,52.7161,-1.36285,443137,313350,SK431133,"Coalville, Ibstock, Markfield",Leicester,1795,1469,58824,24629,"LE6, LE55, LE65, DE74, CV13, DE72, LE10, LE11, DE12, DE73"
LL11,53.0591,-3.02719,331255,351810,SJ312518,"Wrexham, Coedpoeth, Llandegla, Minera, Bradley, Gwersyllt, Rhosrobin, Stansty, Brymbo, Bwlchgwyn, Cymau, Ffrith, Gwynfryn, Tanyfron, Brynteg",Wrexham,1832,1294,38030,16011,"LL12, LL13, LL14, CH5, SY11, CH4, CH7, LL20, CH70, L64"
LL12,53.0859,-2.99031,333768,354756,SJ337547,"Wrexham, Caergwrle, Cefn-y-Bedd, Cymau, Gresford, Hope, Llay, Marford, Rossett",Wrexham,985,876,28346,12037,"LL11, LL13, CH4, LL14, CH5, CH70, CH88, CH99, CH1, CH7"
LL13,53.0363,-2.96358,335484,349214,SJ354492,"Wrexham, Abenbury, Bowling Bank, Holt, Llan-y-Pwll, Pentre Maelor, Ridley Wood, Bangor-on-Dee, Gyfelia, Marchwiel, Overton, Penley, Worthenbury",Wrexham,1233,1036,34888,14688,"LL12, LL11, LL14, CH4, CH70, SY12, SY14, CH88, CH99, CH1"
LL14,52.9924,-3.05254,329448,344415,SJ294444,"Wrexham, Rhosllanerchrugog, Cefn Mawr, Ponciau, Rhostyllen, Chirk, Ruabon",Wrexham,1136,1029,33617,14355,"LL11, LL13, LL20, SY11, LL12, SY10, CH5, SY12, CH7, CH4"
LL15,53.1052,-3.31537,312037,357254,SJ120572,"Ruthin, Bontuchel, Clawddnewydd, Clocaenog, Cyffylliog, Gellifor, Graigfechan, Llanbedr Dyffryn Clwyd, Llanelidan, Llanfair Dyffryn Clwyd, Pwllglas, Rhewl",Denbighshire,571,448,10316,4418,"LL16, LL21, CH7, CH8, LL17, LL20, CH6, LL19, LL11, LL12"
LL16,53.1852,-3.43087,304482,366301,SJ044663,"Denbigh, Bodfari, Llandyrnog, Llanrhaeadr, Bylchau, Groes, Henllan, Llannefydd, Llansannan, Nantglyn, The Green, Trefnant",Denbighshire,753,638,15874,6603,"LL17, LL19, LL18, LL15, LL21, LL22, CH8, CH7, CH6, LL29"
LL17,53.2554,-3.43874,304114,374120,SJ041741,"St. Asaph, Allt Goch, Rhuallt, Tremeirchion, Waen",Conwy,245,221,5410,2298,"LL16, LL18, LL19, LL22, CH8, LL15, LL21, CH6, LL29, LL28"
LL18,53.3118,-3.4777,301645,380447,SJ016804,"Rhyl, Bodelwyddan, Cwm Dyserth, Kinmel Bay, Dyserth, Gwaenysgor, Rhuddlan, Trelawnyd",Conwy,1618,1213,40469,17600,"LL19, LL17, LL22, LL16, LL29, CH8, LL28, LL30, LL31, L48"
LL19,53.3314,-3.4108,306145,382538,SJ061825,"Prestatyn, Gronant",Flintshire,734,596,19929,8772,"LL18, LL17, LL16, CH8, LL22, L48, CH48, CH29, CH47, L47"
LL20,52.961,-3.16228,322025,341035,SJ220410,"Froncysyllte, Garth, Glyn Ceiriog, Llanarmon Dyffryn Ceiriog, Llwynmawr, Pandy, Pontcysyllte, Pontfadog, Rhewl, Tregeiriog, Trevor, Llangollen, Eglwyseg, Llantysilio",Denbighshire,472,381,8127,3543,"LL14, SY10, SY22, SY11, LL11, CH7, LL21, LL13, LL12, LL15"
LL21,52.9888,-3.40829,305562,344424,SJ055444,"Corwen, Cynwyd, Glanrafon, Glasfryn, Llandrillo, Llangwm, Maerdy, Ty Nant, Betws Gwerfil Goch, Bryneglwys, Carrog, Cerrigydrudion, Clawdd Poncen, Derwen, Glyndyfrdwy, Gwyddelwern, Llanfihangel Glyn Myfyr, Llidiart-y-Parc, Melin-y-Wig",Conwy,420,368,6442,2756,"LL15, LL16, LL20, LL23, LL17, LL19, LL14, LL18, SY10, LL24"
LL22,53.2717,-3.5913,293977,376149,SH939761,"Abergele, Betws Yn Rhos, Gwytherin, Llanddulas, Llanfairtalhaiarn, Llangernyw, Moelfre, Pandy Tudur, Rhyd-y-Foel, Glascoed, St. George",Denbighshire,738,642,17890,8147,"LL29, LL18, LL17, LL28, LL31, LL19, LL16, LL32, LL30, LL34"
LL23,52.9058,-3.60231,292332,335465,SH923354,"Bala, Llandderfel, Llanfor, Llanuwchllyn, Sarnau",Gwynedd,222,199,4136,1846,"LL21, LL24, SY19, LL22, LL41, LL26, LL25, LL40, LL16, LL47"
LL24,53.0604,-3.78669,280361,352953,SH803529,"Betws-y-Coed, Capel Curig, Cwm Penmachno, Penmachno, Pentre Du, Pentrefoelas, Ysbyty Ifan",Conwy,213,193,2056,881,"LL26, LL25, LL27, LL41, LL32, LL31, LL28, LL30, LL29, LL34"
LL25,53.0549,-3.8778,274240,352498,SH742524,"Dolwyddelan",Conwy,50,47,501,228,"LL24, LL27, LL41, LL26, LL32, LL34, LL40, LL33, LL31, LL48"
LL26,53.1392,-3.78735,280536,361719,SH805617,"Llanrwst, Capel Garmon, Llanddoged, Melin-y-Coed, Maenan",Conwy,242,212,4528,1964,"LL27, LL24, LL25, LL32, LL31, LL28, LL30, LL29, LL34, LL33"
LL27,53.1482,-3.82715,277899,362788,SH778627,"Trefriw",Conwy,52,47,757,358,"LL26, LL32, LL24, LL25, LL31, LL30, LL28, LL34, LL29, LL33"
LL28,53.2891,-3.75901,282841,378347,SH828783,"Colwyn Bay, Rhos on Sea, Eglwysbach, Glan Conwy, Mochdre, Tal-y-Cafn",Conwy,525,442,14145,6418,"LL29, LL31, LL30, LL32, LL34, LL26, LL22, LL27, LL24, LL33"
LL29,53.2908,-3.7126,285939,378460,SH859784,"Colwyn Bay, Llanelian, Llysfaen, Old Colwyn",Conwy,862,613,20433,8763,"LL28, LL31, LL30, LL22, LL32, LL34, LL26, LL18, LL27, LL24"
LL30,53.3173,-3.81793,278994,381582,SH789815,"Llanrhos, Llandudno, Penrhyn Bay",Conwy,970,677,22010,10107,"LL31, LL32, LL28, LL29, LL34, LL27, LL26, LL33, LL22, LL24"
LL31,53.2912,-3.81084,279393,378666,SH793786,"Deganwy, Glanwydden, Llangwstenin, Llandudno Junction",Conwy,322,280,9344,4104,"LL30, LL28, LL32, LL29, LL34, LL27, LL26, LL33, LL22, LL24"
LL32,53.2615,-3.83994,277368,375413,SH773754,"Conwy, Dolgarrog, Groesffordd, Henryd, Rowen, Tal-y-Bont, Tyn-y-Groes",Conwy,325,279,6502,2942,"LL31, LL30, LL34, LL28, LL27, LL33, LL29, LL26, LL25, LL24"
LL33,53.2499,-3.98367,267746,374379,SH677743,"Abergwyngregyn, Llanfairfechan",Conwy,190,168,3906,1648,"LL34, LL58, LL32, LL57, LL59, LL31, LL30, LL27, LL28, LL75"
LL34,53.2714,-3.91332,272503,376642,SH725766,"Penmaenmawr, Dwygyfylchi",Conwy,207,184,4347,1972,"LL32, LL33, LL31, LL30, LL28, LL58, LL27, LL29, LL25, LL26"
LL35,52.5473,-4.0408,261714,296340,SN617963,"Aberdovey",Gwynedd,106,100,865,488,"LL36, SY24, LL37, LL38, SY23, LL42, LL39, LL43, SY20, LL44"
LL36,52.6031,-4.06593,260188,302594,SH601025,"Tywyn, Abergynolwyn, Bryncrug, Llanegryn, Rhoslefain",Gwynedd,287,248,4660,2265,"LL37, LL35, LL38, LL42, SY24, LL39, LL43, LL44, SY23, LL45"
LL37,52.671,-4.07059,260089,310155,SH600101,"Llwyngwril",Gwynedd,44,40,554,248,"LL38, LL42, LL36, LL39, LL43, LL44, LL35, LL45, LL46, LL47"
LL38,52.6989,-4.03762,262406,313195,SH624131,"Fairbourne, Friog",Gwynedd,52,47,724,384,"LL42, LL39, LL37, LL36, LL43, LL44, LL35, LL45, LL40, LL46"
LL39,52.7128,-4.0007,264943,314671,SH649146,"Arthog",Gwynedd,22,19,236,113,"LL38, LL42, LL37, LL43, LL40, LL44, LL36, LL45, LL35, LL46"
LL40,52.7553,-3.87667,273445,319172,SH734191,"Dolgellau, Brithdir, Drws Y Nant, Ganllwyd, Llanelltyd, Llanfachreth, Rhydymain, Tabor",Gwynedd,409,358,4210,1949,"LL39, SY20, LL42, LL38, LL43, LL44, LL41, LL37, LL45, LL25"
LL41,52.9701,-3.93882,269895,343175,SH698431,"Blaenau Ffestiniog, Talwaenydd, Ffestiniog, Gellilydan, Maentwrog, Manod, Trawsfynydd",Gwynedd,410,372,6472,2996,"LL25, LL48, LL47, LL49, LL24, LL40, LL46, LL27, LL51, LL45"
LL42,52.7262,-4.0538,261399,316262,SH613162,"Barmouth, Llanaber",Gwynedd,182,148,2545,1259,"LL38, LL39, LL37, LL43, LL44, LL36, LL45, LL46, LL47, LL35"
LL43,52.7746,-4.09223,258961,321720,SH589217,"Talybont",Gwynedd,29,28,487,250,"LL44, LL45, LL42, LL46, LL37, LL38, LL39, LL47, LL48, LL36"
LL44,52.7874,-4.09533,258793,323150,SH587231,"Dyffryn Ardudwy",Gwynedd,58,52,1028,492,"LL43, LL45, LL46, LL42, LL37, LL38, LL47, LL39, LL48, LL49"
LL45,52.8202,-4.0971,258780,326801,SH587268,"Llanbedr",Gwynedd,59,54,708,318,"LL44, LL46, LL43, LL47, LL42, LL48, LL49, LL37, LL38, LL39"
LL46,52.8563,-4.10772,258183,330837,SH581308,"Harlech, Llanfair",Gwynedd,99,93,1856,894,"LL45, LL44, LL47, LL43, LL49, LL48, LL42, LL52, LL37, LL38"
LL47,52.902,-4.06252,261372,335832,SH613358,"Talsarnau, Soar, Ynys",Gwynedd,49,47,537,262,"LL48, LL46, LL49, LL45, LL44, LL43, LL42, LL41, LL52, LL38"
LL48,52.9353,-4.07115,260898,339552,SH608395,"Penrhyndeudraeth, Llanfrothen, Minffordd",Gwynedd,170,159,2603,1129,"LL47, LL49, LL46, LL45, LL41, LL44, LL52, LL43, LL51, LL42"
LL49,52.9288,-4.13846,256353,338962,SH563389,"Porthmadog, Borth-y-Gest, Morfa Bychan, Penmorfa, Prenteg, Tremadog",Gwynedd,254,201,4502,2100,"LL48, LL47, LL52, LL46, LL51, LL45, LL44, LL43, LL41, LL55"
LL51,52.9729,-4.23712,249875,344069,SH498440,"Garndolbenmaen",Gwynedd,45,44,888,354,"LL52, LL54, LL49, LL55, LL48, LL47, LL46, LL61, LL56, LL60"
LL52,52.9248,-4.23743,249688,338720,SH496387,"Criccieth, Llanystumdwy, Pentrefelin, Rhoslan",Gwynedd,172,158,2770,1237,"LL51, LL49, LL48, LL54, LL47, LL46, LL55, LL45, LL44, LL53"
LL53,52.8844,-4.48793,232695,334781,SH326347,"Pwllheli, Efailnewydd, Llannor, Abererch, Chwilog, Llithfaen, Nefyn, Pistyll, Plas Gwyn, Y Ffor, Abersoch, Bwlchtocyn, Llanbedrog, Mynytho, Penrhos, Rhydyclafdy, Aberdaron, Boduan, Botwnnog, Edern, Morfa Nefyn, Sarn, Tudweiliog",Gwynedd,894,811,17142,7727,"LL52, LL51, LL63, LL64, LL54, LL49, LL46, LL62, LL47, LL45"
LL54,53.0605,-4.28592,246910,353915,SH469539,"Caernarfon, Clynnogfawr, Llanaelhaearn, Llandwrog, Pontllyfni, Saron, Trefor, Llanllyfni, Nantlle, Penygroes, Rhyd Ddu, Talysarn, Bontnewydd, Carmel, Dinas, Groeslon, Rhosgadfan, Rhostryfan",Gwynedd,575,518,11380,4863,"LL51, LL55, LL61, LL60, LL52, LL56, LL77, LL62, LL49, LL78"
LL55,53.1338,-4.21119,252169,361911,SH521619,"Caernarfon, Bethel, Bontnewydd, Caeathro, Brynrefail, Clwt-y-Bont, Deiniolen, Penisarwaun, Beddgelert, Ceunant, Cwm-y-Glo, Llanberis, Llanrug, Nant Gwynant, Nant Peris, Waunfawr",Gwynedd,977,737,21444,9231,"LL56, LL61, LL60, LL54, LL59, LL75, LL57, LL51, LL76, LL74"
LL56,53.1877,-4.20005,253098,367883,SH530678,"Y Felinheli",Gwynedd,89,73,2299,1014,"LL55, LL61, LL59, LL60, LL57, LL75, LL76, LL74, LL77, LL58"
LL57,53.2098,-4.11625,258769,370172,SH587701,"Bangor, Llanllechid, Rachub, Talybont, Bethesda, Glasinfryn, Llandygai, Mynydd Llandygai, Rhiwlas, Tregarth",Gwynedd,1152,893,27588,10029,"LL59, LL58, LL56, LL61, LL60, LL55, LL33, LL75, LL76, LL74"
LL58,53.2792,-4.10084,260025,377861,SH600778,"Beaumaris, Llanddona, Llanfaes, Llangoed, Penmon",Anglesey,219,193,3883,1866,"LL57, LL59, LL75, LL33, LL76, LL74, LL56, LL34, LL73, LL78"
LL59,53.2346,-4.16115,255855,373020,SH558730,"Menai Bridge, Llandegfan, Llansadwrn",Anglesey,236,200,5611,2456,"LL57, LL56, LL58, LL75, LL60, LL61, LL76, LL55, LL74, LL77"
LL61,53.197,-4.25904,249190,369040,SH491690,"Llanfairpwllgwyngyll, Brynsiencyn, Dwyran, Newborough",Anglesey,269,246,6335,2664,"LL60, LL56, LL55, LL77, LL76, LL75, LL78, LL59, LL62, LL74"
LL62,53.2112,-4.38599,240763,370895,SH407708,"Bodorgan, Bethel, Hermon, Llangristiolus, Malltraeth, Trefdraeth",Anglesey,127,119,1694,708,"LL63, LL77, LL60, LL71, LL61, LL64, LL66, LL68, LL56, LL78"
LL63,53.2195,-4.47057,235148,372010,SH351720,"Ty Croes, Aberffraw, Llanfaelog",Anglesey,110,105,1339,616,"LL64, LL62, LL65, LL77, LL67, LL60, LL71, LL66, LL61, LL68"
LL64,53.2291,-4.51476,232236,373180,SH322731,"Rhosneigr",Anglesey,60,58,1001,486,"LL63, LL65, LL62, LL77, LL67, LL71, LL60, LL66, LL61, LL68"
LL65,53.301,-4.57519,228491,381320,SH284813,"Holyhead, Trearddur Bay, Four Mile Bridge, Rhoscolyn, Bodedern, Bryngwran, Caergeiliog, Llanynghenedl, Trefor, Valley, Gwalchmai, Llanddeusant, Llanfachraeth, Llanfaethlu, Llanfairynghornwy, Llanrhyddlad, Rhydwyn",Anglesey,1026,910,23565,10248,"LL64, LL63, LL67, LL71, LL66, LL62, LL68, LL77, LL78, LL76"
LL67,53.4112,-4.45628,236836,393298,SH368932,"Cemaes Bay, Tregele",Anglesey,70,61,1416,673,"LL66, LL68, LL69, LL71, LL63, LL70, LL65, LL64, LL62, LL72"
LL68,53.3986,-4.37518,242179,391714,SH421917,"Amlwch, Bull Bay, Carreglefn, Llanfechell, Rhosybol",Anglesey,273,228,6115,2673,"LL66, LL69, LL71, LL67, LL70, LL72, LL78, LL73, LL62, LL77"
LL69,53.3862,-4.31946,245838,390213,SH458902,"Penysarn",Anglesey,35,35,735,315,"LL70, LL68, LL66, LL71, LL72, LL78, LL73, LL77, LL74, LL67"
LL70,53.3639,-4.28778,247865,387664,SH478876,"Dulas",Anglesey,20,20,269,117,"LL69, LL72, LL78, LL73, LL74, LL76, LL71, LL68, LL77, LL66"
LL71,53.3271,-4.36886,242335,383747,SH423837,"Llanerchymedd",Anglesey,97,84,1865,773,"LL68, LL66, LL69, LL78, LL70, LL77, LL73, LL62, LL72, LL74"
LL72,53.344,-4.24589,250582,385363,SH505853,"Moelfre",Anglesey,47,43,820,385,"LL73, LL74, LL78, LL76, LL70, LL75, LL69, LL71, LL60, LL77"
LL73,53.3352,-4.24491,250617,384382,SH506843,"Marianglas",Anglesey,12,12,233,117,"LL72, LL74, LL78, LL76, LL70, LL75, LL69, LL71, LL60, LL77"
LL74,53.3149,-4.23428,251254,382102,SH512821,"Tyn-y-Gongl, Benllech",Anglesey,93,78,2389,1186,"LL76, LL73, LL78, LL72, LL75, LL70, LL60, LL77, LL61, LL71"
LL75,53.2834,-4.22096,252032,378571,SH520785,"Pentraeth, Red Wharf Bay, Rhoscefnhir",Anglesey,67,60,1533,638,"LL76, LL74, LL73, LL78, LL72, LL59, LL60, LL77, LL56, LL58"
LL76,53.3009,-4.23934,250868,380555,SH508805,"Llanbedrgoch",Anglesey,10,9,280,122,"LL74, LL75, LL73, LL78, LL72, LL70, LL60, LL77, LL61, LL59"
LL77,53.2594,-4.31282,245822,376095,SH458760,"Bodffordd, Rhostrehwfa, Talwrn, Llangefni",Anglesey,350,244,7085,3022,"LL60, LL78, LL76, LL75, LL61, LL62, LL71, LL70, LL69, LL74"
LL78,53.3173,-4.26333,249327,382429,SH493824,"Brynteg",Anglesey,22,21,502,209,"LL74, LL73, LL76, LL72, LL70, LL75, LL60, LL77, LL71, LL61"
LN1,53.2562,-0.584819,494508,374177,SK945741,"Lincoln city centre, Stow",West Lindsey,1082,906,28261,12211,"LN6, LN2, LN5, LN3, DN21, LN4, NG23, DN16, LN8, NG32"
LN2,53.2592,-0.511003,499425,374611,SK994746,"Nettleham, Ermine & St Giles Estates",West Lindsey,1537,1116,38730,16454,"LN1, LN5, LN6, LN3, LN4, LN8, DN20, DN21, NG34, LN10"
LN3,53.2808,-0.339013,510841,377267,TF108772,"Lincoln",Lincoln,600,288,8884,3850,"LN8, LN4, LN2, LN7, LN10, LN1, LN9, LN5, LN6, DN38"
LN4,53.1532,-0.390622,507720,362994,TF077629,"Branston, Canwick, Coningsby, Dunston, Heighington, Nocton, Washingborough, Timberland, Martin",North Kesteven,1336,1092,38539,16126,"NG34, LN3, LN10, LN5, LN2, LN6, LN8, LN1, LN9, LN7"
LN5,53.1874,-0.553122,496777,366567,SK967665,"Waddon",Lincoln,1590,1012,32968,14189,"LN6, LN1, LN2, LN4, LN3, NG23, NG32, NG34, NG31, NG24"
LN6,53.2028,-0.596755,493828,368222,SK938682,"Doddington Park, Birchwood, North/South Hykeham",Lincoln,1724,1442,57576,23920,"LN5, LN1, LN2, LN4, NG23, NG32, DN21, NG31, LN3, NG24"
LN7,53.4893,-0.340497,510203,400458,TA102004,"Market Rasen",Lincoln,300,259,6042,2610,"LN8, DN38, DN39, LN3, DN19, DN20, DN41, DN40, DN37, HU1"
LN8,53.3756,-0.329242,511246,387827,TF112878,"Market Rasen",Lincoln,795,649,17235,7545,"LN3, LN7, DN39, DN38, LN4, LN2, LN10, DN41, DN19, DN40"
LN9,53.216,-0.111771,526181,370435,TF261704,"Horncastle",Lincoln,478,385,9687,4435,"LN10, PE23, LN11, LN3, PE20, PE22, PE21, DN33, LN4, DN34"
LN10,53.1577,-0.215942,519388,363772,TF193637,"Woodhall Spa",Lincoln,234,192,5977,2697,"LN9, LN4, LN3, PE23, LN8, PE20, NG34, LN5, PE22, PE21"
LN11,53.3723,0.0224422,534650,388065,TF346880,"Louth",Lincoln,1384,1147,28197,12598,"DN36, DN35, PE23, LN13, LN12, DN32, DN33, LN9, DN31, DN34"
LN12,53.3296,0.262858,550793,383796,TF507837,"Mablethorpe, Sutton-on-Sea",East Lindsey,520,437,13244,6361,"LN13, PE24, PE25, LN11, PE23, DN36, LN9, PE22, DN35, DN32"
LN13,53.2648,0.18283,545684,376423,TF456764,"Alford",Lincoln,398,334,7801,3376,"LN12, PE23, PE24, PE25, LN11, LN9, PE22, DN36, PE21, LN10"
LS1,53.7974,-1.55296,429544,433547,SE295335,"Leeds city centre",Leeds,1667,523,3887,2138,"LS2, LS3, LS11, LS7, LS6, LS4, LS9, LS98, LS12, LS10"
LS2,53.8014,-1.54747,429903,433994,SE299339,"Leeds city centre, Woodhouse",Leeds,750,335,9397,2895,"LS1, LS3, LS7, LS11, LS6, LS9, LS4, LS98, LS10, LS8"
LS3,53.8015,-1.56317,428868,433999,SE288339,"Woodhouse",Leeds,226,111,4968,1155,"LS1, LS2, LS6, LS4, LS11, LS7, LS12, LS9, LS5, LS98"
LS4,53.8085,-1.58278,427572,434770,SE275347,"Burley, Kirkstall, Kirkstall Valley",Leeds,309,203,9003,3820,"LS6, LS3, LS5, LS12, LS1, LS2, LS7, LS13, LS11, LS16"
LS5,53.8181,-1.60238,426276,435831,SE262358,"Hawksworth, Kirkstall",Leeds,274,203,8755,3467,"LS4, LS12, LS16, LS6, LS13, LS3, LS7, LS18, LS1, LS27"
LS6,53.8185,-1.56638,428645,435889,SE286358,"Beckett Park, Headingley, Hyde Park, Meanwood, Woodhouse",Leeds,1332,873,47533,16642,"LS3, LS4, LS7, LS1, LS2, LS5, LS11, LS12, LS8, LS16"
LS7,53.8177,-1.54049,430350,435811,SE303358,"Chapel Allerton, Chapeltown, Little London, Meanwood, Potternewton, Scott Hall, Sheepscar",Leeds,1125,675,29437,13154,"LS2, LS6, LS8, LS1, LS3, LS9, LS4, LS17, LS98, LS11"
LS8,53.8217,-1.51234,432201,436268,SE322362,"Fearnville, Gipton, Gledhow, Harehills, Oakwood, Roundhay",Leeds,1429,931,47805,18339,"LS9, LS7, LS17, LS2, LS6, LS14, LS99, LS1, LS98, LS3"
LS9,53.7988,-1.51179,432254,433721,SE322337,"Burmantofts, Cross Green, East End Park, Gipton, Harehills, Osmondthorpe, Richmond Hill",Leeds,1314,873,37383,17408,"LS8, LS2, LS99, LS1, LS98, LS7, LS10, LS3, LS11, LS88"
LS10,53.7653,-1.53174,430965,429985,SE309299,"Belle Isle, Hunslet, Middleton, Stourton",Leeds,1259,894,35616,15945,"LS98, LS88, LS99, LS11, WF3, LS2, LS1, LS9, LS7, LS3"
LS11,53.7781,-1.55676,429307,431398,SE293313,"Beeston, Beeston Hill, Cottingley, Holbeck",Leeds,1538,962,34737,15491,"LS1, LS98, LS3, LS2, LS10, LS88, LS6, LS12, LS7, LS4"
LS12,53.7914,-1.59529,426759,432863,SE267328,"Armley, Farnley, New Farnley, Wortley",Leeds,1734,1180,40736,18373,"LS4, LS5, LS3, LS1, LS11, LS27, LS6, LS2, LS13, LS16"
LS13,53.8111,-1.63492,424137,435041,SE241350,"Bramley, Rodley, Swinnow",Leeds,1158,900,34757,15551,"LS18, LS5, LS28, LS4, LS12, LS16, LS6, LS3, LS27, LS1"
LS14,53.827,-1.45831,435753,436884,SE357368,"Killingbeck, Seacroft, Scarcroft, Swarcliffe, Thorner, Whinmoor",Leeds,1253,931,34042,14858,"LS15, LS8, LS9, LS26, LS7, LS17, LS99, LS2, LS6, LS1"
LS15,53.8067,-1.44629,436562,434632,SE365346,"Austhorpe, Barwick-in-Elmet, Colton, Cross Gates, Halton, Halton Moor, Scholes, Whitkirk",Leeds,1195,970,34715,15100,"LS14, LS26, LS9, LS8, LS99, LS7, LS2, LS1, LS98, LS3"
LS16,53.8505,-1.60423,426134,439435,SE261394,"Adel, Bramhope, Cookridge, Eccup, Far Headingley, Holt Park, Ireland Wood, Lawnswood, Moor Grange, Tinshill, Weetwood, West Park",Leeds,1379,973,36388,15526,"LS5, LS18, LS4, LS12, LS6, LS13, LS17, LS3, LS19, LS7"
LS17,53.8583,-1.52906,431073,440333,SE310403,"Alwoodley, Bardsey, East Keswick, Eccup, Harewood, Moor Allerton, Moortown, Shadwell, Weardley, Wike",Leeds,1774,1267,43193,18524,"LS7, LS8, LS2, LS9, LS6, LS16, LS1, LS98, LS3, LS10"
LS18,53.8409,-1.64457,423485,438353,SE234383,"Horsforth",Leeds,693,522,19159,8475,"LS13, LS16, LS19, LS28, LS5, BD10, LS4, LS12, LS6, LS20"
LS19,53.8607,-1.68583,420761,440543,SE207405,"Rawdon, Yeadon",Leeds,845,576,19898,8694,"LS20, LS21, LS18, BD10, LS28, LS16, BD2, BD17, LS13, BD3"
LS20,53.8733,-1.71372,418921,441937,SE189419,"Guiseley",Leeds,472,355,12319,5203,"LS19, BD10, LS21, BD2, BD17, BD3, LS18, BD4, BD18, BD98"
LS21,53.9102,-1.68282,420934,446051,SE209460,"Arthington, Otley, Pool",Leeds,870,644,17846,7903,"LS19, LS20, LS18, LS28, BD10, LS29, LS16, LS13, BD2, BD17"
LS22,53.9316,-1.39273,439970,448556,SE399485,"Collingham, Linton, Wetherby",Leeds,1123,566,15747,6845,"LS23, HG5, YO51, YO5, LS14, LS15, HG2, LS24, HG1, LS17"
LS23,53.9066,-1.35297,442606,445798,SE426457,"Boston Spa, Bramham, Clifford, Thorp Arch, Walton",Leeds,528,361,9149,3690,"LS22, LS24, LS25, YO5, LS14, WF10, LS15, HG5, YO51, LS17"
LS24,53.8714,-1.25499,449084,441945,SE490419,"Saxton, Stutton, Ulleskelf, Church Fenton, Tadcaster, Toulston",Selby,522,405,11820,4955,"LS23, LS25, WF11, YO26, YO23, LS22, YO5, YO2, YO24, WF8"
LS25,53.7862,-1.32574,444522,432419,SE445324,"Aberford, Ferry Fryston, Garforth, Hillam, Kippax, Ledsham, Micklefield, Monk Fryston, Sherburn-in-Elmet",Leeds,1410,1152,40227,16889,"WF10, WF8, LS15, WF11, WF7, LS23, LS26, LS24, WF6, LS14"
LS26,53.7565,-1.44358,436784,429048,SE367290,"Great Preston, Methley, Mickletown, Oulton, Rothwell, Swillington, Woodlesford",Leeds,1015,796,30320,12905,"LS15, LS99, WF6, LS14, LS88, LS10, LS98, LS9, WF3, WF10"
LS27,53.7491,-1.60487,426154,428153,SE261281,"Churwell, Gildersome, Morley",Leeds,1445,1085,35682,16165,"LS12, WF17, LS5, LS88, BD11, LS11, LS4, WF12, LS10, LS13"
LS28,53.8016,-1.66916,421888,433973,SE218339,"Calverley, Farsley, Pudsey, Stanningley",Leeds,1502,1136,38405,16851,"LS13, BD11, LS18, BD3, LS19, BD4, BD2, LS5, LS12, BD10"
LS29,53.9197,-1.80456,412934,447079,SE129470,"Addingham, Ben Rhydding, Burley in Wharfedale, Ilkley, Menston",Bradford,1657,1205,31753,13715,"BD16, BD97, BD17, BD18, BD9, LS21, LS20, BD98, BD8, BD15"
LU1,51.8764,-0.424698,508540,220931,TL085209,"Luton (South), Aley Green, Caddington, Lower Woodside, Pepperstock, Skimpot, Slip End, Woodside",Luton,1806,930,43445,16299,"LU2, LU3, LU4, LU6, LU5, AL5, HP2, AL3, WD5, HP1"
LU2,51.8908,-0.397853,510352,222573,TL103225,"Luton (East), Chiltern Green, Cockernhoe, East Hyde, Lawrence End, Lilley, New Mill End, Peters Green, Tea Green, The Hyde, Wandon End, Wandon Green, Winch Hill",Luton,1365,976,56481,22565,"LU1, LU3, LU4, AL5, LU5, LU6, AL3, SG4, HP2, SG5"
LU3,51.9067,-0.443357,507183,224274,TL071242,"Luton (North), Lower Sundon, Streatley, Sundon",Luton,1268,841,61454,21868,"LU4, LU1, LU2, LU5, LU6, MK45, HP2, AL5, HP1, HP3"
LU4,51.8985,-0.465242,505697,223330,TL056233,"Luton (West), Chalton, Leagrave",Luton,1033,729,51547,17652,"LU3, LU5, LU1, LU2, LU6, MK45, HP2, HP1, HP3, AL5"
LU5,51.9074,-0.515015,502252,224248,TL022242,"Dunstable (East including Woodside Estate), Bidwell, Chalgrave, Fancott, Harlington, Houghton Regis (including Townsend Industrial Estate), Thorn, Toddington",Central Bedfordshire,1012,703,38037,15310,"LU6, LU4, LU3, LU1, LU2, LU7, LU95, MK45, HP1, HP4"
LU6,51.8809,-0.532787,501089,221277,TL010212,"Dunstable (West), Eaton Bray, Edlesborough, Holywell, Kensworth, Northall, Sewell, Studham, Totternhoe, Whipsnade",Central Bedfordshire,1270,720,31299,13141,"LU5, LU4, LU1, LU3, LU2, HP4, LU7, LU95, HP1, HP2"
LU7,51.9109,-0.661888,492142,224442,SP921244,"Leighton Buzzard, Bragenham, Briggington, Burcott, Cheddington, Chelmscote, Clipstone, Crafton, Cublington, Eggington, Great Billington, Grove, Heath and Reach, Hockliffe, Horton, Hollingdon, Ivinghoe, Ivinghoe Aston, Ledburn, Leedon, Little Billington, Mentmore, Pitstone, Slapton, Soulbury, Stanbridge, Stewkley, Stockgrove, Tebworth, Tilsworth, Wing, Wingfield",Central Bedfordshire,2621,1346,53832,22314,"LU95, HP23, MK17, MK7, MK2, LU5, LU6, MK10, MK1, MK3"
M1,53.4777,-2.23681,384381,397912,SJ843979,"Piccadilly, Northern Quarter, Manchester City Centre",Manchester,994,509,12340,5233,"M2, M60, M4, M61, M99, M3, M15, M13, M8, M14"
M2,53.4803,-2.24466,383861,398203,SJ838982,"Deansgate, Manchester City Centre",Manchester,684,218,88,54,"M1, M3, M60, M4, M61, M99, M15, M8, M7, M5"
M3,53.4835,-2.25218,383363,398561,SJ833985,"Manchester City Centre, Blackfriars, Trinity",Manchester,1102,554,11844,6667,"M2, M15, M60, M1, M4, M61, M99, M7, M8, M5"
M4,53.4848,-2.23073,384787,398700,SJ847987,"Ancoats, Northern Quarter, Strangeways",Manchester,768,463,10675,6072,"M61, M60, M99, M1, M2, M3, M8, M13, M15, M14"
M5,53.4797,-2.28576,381133,398146,SJ811981,"Ordsall, Seedley, Weaste, University",Salford,1471,589,15290,7401,"M50, M6, M3, M17, M2, M16, M15, M7, M1, M32"
M6,53.4915,-2.29595,380462,399462,SJ804994,"Claremont, Irlams O' Th' Height, Charlestown, Whitlane",Salford,1178,800,32614,14395,"M50, M5, M17, M7, M3, M32, M25, M45, M2, M27"
M7,53.5042,-2.26161,382745,400866,SD827008,"Higher Broughton, Cheetwood, Lower Broughton, Kersal",Salford,1598,769,27938,11213,"M8, M3, M2, M6, M25, M15, M60, M5, M61, M4"
M8,53.509,-2.24087,384123,401395,SD841013,"Crumpsall, Cheetham Hill",Manchester,1798,796,30934,11246,"M7, M60, M2, M61, M4, M99, M1, M3, M9, M10"
M9,53.5216,-2.21439,385883,402791,SD858027,"Harpurhey, Blackley",Manchester,1951,1077,39434,17544,"M8, M10, M40, M24, M99, M61, M4, M60, M13, M7"
M11,53.4784,-2.18328,387933,397979,SJ879979,"Clayton, Openshaw, Beswick",Manchester,1101,741,20281,8594,"M18, M40, M10, M12, M43, M35, M13, M19, M99, M4"
M12,53.4656,-2.20559,386449,396559,SJ864965,"Ardwick, Longsight, Chorlton-on-Medlock",Manchester,866,499,16377,6347,"M13, M52, M11, M18, M19, M14, M1, M99, M4, M61"
M13,53.4622,-2.21715,385680,396183,SJ856961,"Ardwick, Longsight, Chorlton-on-Medlock",Manchester,755,486,23642,6947,"M52, M12, M14, M1, M99, M4, M61, M60, M15, M18"
M14,53.4469,-2.22506,385150,394483,SJ851944,"Fallowfield, Moss Side, Ladybarn, Rusholme",Manchester,1554,1053,53136,17252,"M52, M13, M20, M12, M19, M1, M99, M4, M61, M60"
M15,53.4661,-2.2524,383341,396625,SJ833966,"Hulme, Manchester Science Park",Manchester,903,559,21967,9484,"M3, M2, M16, M1, M60, M13, M4, M61, M99, M14"
M16,53.4559,-2.26509,382495,395493,SJ824954,"Firswood, Old Trafford, Whalley Range",Trafford,1489,865,35559,13805,"M15, M21, M3, M5, M2, M50, M14, M32, M1, M7"
