Postcode,Latitude,Longitude,Easting,Northing,Grid Reference,Town/Area,Region,Postcodes,Active postcodes,Population,Households,Nearby districts
PO41,50.6998,-1.47809,436955,89036,SZ369890,"Yarmouth",Isle of Wight,170,151,2183,1054,"PO40, PO39, SO41, SO4, SO42, PO30, PO31, SO45, BH25, SO40"
PR1,53.7579,-2.70186,353823,429288,SD538292,"City Centre, Avenham, Broadgate, Deepdale, Fishwick, St. Matthew's, Penwortham",Preston,2862,1664,72238,29247,"PR0, PR2, PR11, PR5, PR25, PR26, PR3, PR4, PR7, PR6"
PR2,53.7755,-2.70548,353604,431249,SD536312,"Ashton On Ribble, Brookfield, Cadley, Fulwood, Grimsargh, Haighton, Ingol, Larches, Lea, Ribbleton, Riversway, Sharoe Green, Tanterton",Preston,2996,1740,78732,33307,"PR1, PR11, PR0, PR5, PR25, PR3, PR26, PR4, PR7, PR6"
PR3,53.8676,-2.71777,352898,441504,SD528415,"Barnacre-with-Bonds, Barton, Bilsborrow, Bonds, Bowgreave, Broughton, Calder Vale, Chipping, Garstang, Goosnargh, Great Eccleston, Little Eccleston, Longridge, Myerscough, Oakenclough, Pilling, Ribchester, St Michael's On Wyre, Scorton, Whittingham",Fylde,1599,1283,37542,15553,"PR2, PR11, PR1, PR0, PR5, PR25, PR26, PR4, LA2, LA1"
PR4,53.7529,-2.83166,345259,428824,SD452288,"Becconsall, Catforth, Clifton, Cottam, Eaves, Elswick, Freckleton, Hesketh Bank, Hutton, Inskip, Kirkham, Longton, Much Hoole, New Longton, Newton, Tarleton, Thistleton, Walmer Bridge, Warton, Wesham, Woodplumpton, Wrea Green",Fylde,2115,1680,57802,23993,"PR1, PR2, PR0, PR26, L40, PR11, FY8, FY0, PR5, PR25"
PR5,53.7132,-2.68125,355135,424302,SD551243,"Bamber Bridge, Coupe Green, Gregson Lane, Higher Walton, Hoghton, Lostock Hall, Riley Green, Samlesbury, Walton-le-Dale, Walton Park, Walton Summit",South Ribble,2356,974,40905,17370,"PR25, PR0, PR1, PR11, PR26, PR2, PR7, PR6, WN6, WN5"
PR6,53.6646,-2.61449,359494,418855,SD594188,"Abbey Village, Adlington, Anderton, Anglezarke, Astley Village, Brindle, Brinscall, Clayton-le-Woods, Cuerden, Heapey, Heath Charnock, Wheelton, White Coppice, Whittle-le-Woods, Withnell",Chorley,1514,1045,34641,14786,"PR7, PR25, PR5, WN1, WN6, PR26, BL6, WN2, PR0, WN3"
PR7,53.6487,-2.65279,356947,417108,SD569171,"Adlington, Buckshaw Village, Charnock Richard, Coppull, Eccleston, Euxton, Heath Charnock, Heskin",Chorley,1867,1458,55673,23826,"PR6, PR25, WN6, PR5, WN1, PR26, WN3, PR0, WN5, PR1"
PR8,53.6276,-3.00541,333606,415033,SD336150,"Ainsdale, Birkdale, Blowick",Sefton,2012,1242,53876,23158,"PR9, FY8, L37, FY0, L29, L38, L23, L21, L72, L22"
PR9,53.657,-2.97189,335867,418273,SD358182,"Banks, Churchtown, Crossens, Marshside",Sefton,1297,940,42860,19547,"PR8, FY8, FY0, L29, L39, L30, L31, L40, L72, L80"
PR25,53.6954,-2.6955,354175,422331,SD541223,"Leyland, Clayton-le-Woods, Farington",South Ribble,923,734,30710,13083,"PR5, PR26, PR1, PR0, PR7, PR2, PR11, PR6, WN6, WN5"
PR26,53.6887,-2.73786,351370,421614,SD513216,"Leyland, Bretherton, Croston, Farington Moss, Moss Side, Ulnes Walton",South Ribble,352,295,15387,5518,"PR25, PR5, PR1, PR2, PR0, PR7, PR11, PR6, PR4, WN8"
RG1,51.4516,-0.970848,471610,173015,SU716730,"Reading",Berkshire,2802,1212,43280,18164,"RG4, RG30, RG2, RG6, RG3, RG5, RG31, RG10, RG9, RG41"
RG2,51.4247,-0.955875,472693,170038,SU726700,"Whitley",Berkshire,1358,968,37668,14210,"RG6, RG1, RG4, RG5, RG30, RG3, RG41, RG31, RG27, RG40"
RG4,51.478,-0.965359,471950,175956,SU719759,"Caversham",Berkshire,1723,987,39164,15838,"RG1, RG2, RG6, RG30, RG5, RG3, RG31, RG10, RG9, RG8"
RG5,51.4529,-0.907132,476035,173224,SU760732,"Woodley",Wokingham,675,502,25444,10060,"RG6, RG1, RG10, RG2, RG4, RG41, RG30, RG9, RG3, RG40"
RG6,51.4424,-0.933468,474222,172029,SU742720,"Earley",Wokingham,1749,764,36839,13534,"RG5, RG2, RG1, RG4, RG30, RG41, RG10, RG3, RG9, RG31"
RG7,51.3974,-1.08162,463988,166885,SU639668,"Aldermaston, Bradfield, Burghfield Common, Silchester, Mortimer, Theale",Berkshire,1927,1465,31485,12466,"RG26, RG31, RG3, RG24, RG30, RG8, RG21, RG19, RG2, RG1"
RG8,51.5053,-1.10693,462081,178863,SU620788,"Goring, Streatley",South Oxfordshire,1293,840,18698,7411,"RG31, OX10, RG3, RG7, RG30, RG4, RG26, RG1, RG18, RG9"
RG9,51.5426,-0.920392,474967,183185,SU749831,"Hambleden, Rotherfield Peppard, Turville, Turville Heath, Skirmett, Rockwell End, Mill End, Fawley, Fingest, Frieth, Greenlands, Nettlebed, Shiplake",South Oxfordshire,1789,1146,23037,9550,"RG5, RG4, RG6, RG10, RG1, RG2, OX39, SL7, RG30, OX49"
RG10,51.48,-0.867396,478749,176279,SU787762,"Charvil, Hurst, Ruscombe, Twyford, Wargrave",Wokingham,944,672,18179,7398,"RG5, RG41, RG4, RG6, RG40, RG11, RG9, RG1, RG2, RG42"
RG11,51.3986,-0.839517,480829,167257,SU808672,"Wokingham, Winnersh, Crowthorne",Wokingham,2215,0,,,"RG40, RG41, RG45, GU46, GU17, GU47, RG12, RG42, RG10, GU51"
RG12,51.4119,-0.752729,486841,168835,SU868688,"Bracknell, Bullbrook, Wick Hill",Bracknell Forest,3218,1074,52209,21918,"RG42, GU15, RG45, RG40, GU95, SL5, RG11, GU47, RG41, GU19"
RG13,51.4054,-1.28932,449530,167614,SU495676,"Newbury, Thatcham",Berkshire,1028,0,,,"RG14, RG20, RG18, RG19, RG15, RG16, RG28, RG7, RG26, OX11"
RG14,51.3983,-1.32134,447310,166803,SU473668,"Newbury",Berkshire,2003,1243,37698,16324,"RG20, RG13, RG15, RG19, RG18, RG16, RG28, RG17, RG7, RG26"
RG15,51.3576,-1.34484,445716,162262,SU457622,"Newbury, Kintbury, Headley, Kingsclere, Woolton Hill",Berkshire,817,0,,,"RG20, RG14, RG13, RG16, RG28, RG19, RG18, RG26, RG17, SP10"
RG16,51.4711,-1.36218,444399,174874,SU443748,"Chieveley, Compton, Lambourn",West Berkshire,1079,0,,,"RG20, RG14, RG15, RG13, RG18, RG17, OX12, RG19, OX13, OX11"
RG17,51.4378,-1.49831,434969,171097,SU349710,"Hungerford",Berkshire,922,655,15203,6596,"RG16, RG20, RG14, SN8, SP11, OX12, RG15, RG13, SP10, RG18"
RG18,51.431,-1.24755,452406,170490,SU524704,"Hampstead Norreys, Hermitage, Yattendon",West Berkshire,678,534,19725,7220,"RG19, RG13, RG14, RG20, RG16, RG15, OX11, RG7, RG26, RG8"
RG19,51.3964,-1.22569,453967,166658,SU539666,"Thatcham",Berkshire,818,480,16916,6829,"RG18, RG13, RG14, RG20, RG7, RG26, RG15, RG16, RG23, OX11"
RG20,51.4031,-1.33484,446366,167328,SU463673,"Chieveley, Compton",West Berkshire,1176,929,19256,7584,"RG14, RG13, RG15, RG16, RG18, RG19, RG28, RG17, RG7, RG26"
RG21,51.2668,-1.09051,463550,152353,SU635523,"Basingstoke Town Centre, Eastrop, Black Dam",Hampshire,1899,765,26824,11665,"RG24, RG25, RG22, RG23, RG26, RG7, RG29, RG27, GU34, RG31"
RG22,51.2522,-1.12289,461310,150702,SU613507,"South Ham, Brighton Hill, Kempshott, Buckskin",Hampshire,1018,778,41986,17007,"RG23, RG21, RG25, RG24, RG26, RG29, RG7, SO24, RG28, RG27"
RG23,51.26,-1.14698,459619,151549,SU596515,"Winklebury, Rooksdown, Oakley",Hampshire,416,323,12114,4947,"RG22, RG21, RG25, RG24, RG26, SO24, RG7, RG28, RG29, RG19"
RG24,51.2798,-1.07855,464366,153809,SU643538,"Popley, Chineham, Sherborne St John",Hampshire,1716,894,31488,12948,"RG21, RG25, RG22, RG23, RG26, RG7, RG27, RG29, RG31, RG3"
RG25,51.2358,-1.08526,463959,148910,SU639489,"Cliddesden, Dummer, Overton",Hampshire,738,386,8495,3573,"RG21, RG24, RG22, RG23, RG29, RG26, RG7, GU34, RG27, SO24"
RG26,51.3481,-1.12813,460818,161362,SU608613,"Baughurst, Bramley, Brimpton Common, Pamber End, Pamber Heath, Tadley",Hampshire,1194,641,22373,9191,"RG7, RG22, RG23, RG24, RG21, RG19, RG25, RG8, RG31, RG18"
RG27,51.3059,-0.948683,473382,156833,SU733568,"Hook, Sherfield-on-Loddon, Stratfield Turgis, Turgis Green",Hampshire,1270,827,20686,8305,"RG29, RG2, GU51, GU13, GU52, RG6, RG24, GU46, RG1, GU17"
RG28,51.2349,-1.32918,446931,148626,SU469486,"Whitchurch",Hampshire,282,225,5766,2460,"RG15, RG14, SO22, RG20, SO21, SP10, SO23, SP11, SO25, RG23"
RG30,51.4532,-1.00944,468926,173156,SU689731,"Tilehurst, Purley-on-Thames, Southcote",Berkshire,1450,966,43731,17963,"RG3, RG31, RG1, RG4, RG2, RG6, RG5, RG7, RG8, RG10"
RG31,51.4566,-1.03994,466802,173506,SU668735,"Calcot Row, Tilehurst",Berkshire,781,618,27996,11134,"RG3, RG30, RG1, RG4, RG7, RG8, RG2, RG6, RG5, RG10"
RG40,51.4026,-0.835812,481079,167706,SU810677,"Wokingham, Finchampstead, Barkham",Wokingham,1538,955,26725,10856,"RG11, RG41, RG45, GU46, RG12, GU17, GU47, RG42, RG10, GU51"
RG41,51.4158,-0.857411,479554,169150,SU795691,"Winnersh, Woosehill, Emmbrook, Sindlesham",Wokingham,1124,755,28230,10882,"RG40, RG11, RG10, RG5, RG45, RG6, RG42, RG2, RG12, GU46"
RG42,51.4248,-0.760047,486308,170261,SU863702,"Binfield, Newell Green, Priestwood, Warfield, Winkfield Row",Bracknell Forest,1414,921,25786,10587,"RG12, RG45, RG40, GU15, GU95, RG11, RG41, GU47, SL5, SL6"
RG45,51.3785,-0.802737,483424,165063,SU834650,"Crowthorne, Ravenswood",Bracknell Forest,601,418,14220,5312,"GU47, GU17, RG11, RG40, GU46, RG12, RG42, RG41, GU95, GU15"
RH1,51.2379,-0.159122,528608,150356,TQ286503,"Redhill, Bletchingley, Nutfield, Merstham, South Nutfield",Reigate and Banstead,1969,1249,46680,19155,"RH2, RH6, RH9, CR5, RH77, KT20, CR3, RH10, SM7, RH3"
RH2,51.2366,-0.203276,525529,150135,TQ255501,"Reigate",Reigate and Banstead,1281,839,26119,10513,"RH1, KT20, RH3, SM7, RH6, SM2, RH11, RH9, RH77, RH4"
RH3,51.2327,-0.284631,519860,149566,TQ198495,"Betchworth, Brockham, Buckland, Strood Green",Mole Valley,181,143,4313,1778,"RH4, RH2, RH5, KT21, KT20, KT18, KT22, RH1, KT19, KT23"
RH4,51.2307,-0.333891,516426,149264,TQ164492,"Dorking",Mole Valley,1079,678,15634,6803,"RH5, RH3, KT22, KT23, KT21, KT24, RH2, KT20, KT18, RH12"
RH5,51.196,-0.342292,515926,145392,TQ159453,"Capel, Westhumble, Mickleham, Ockley",Mole Valley,841,640,16472,6606,"RH4, RH3, KT22, KT23, RH12, KT21, KT24, RH13, RH2, KT10"
RH6,51.1714,-0.165265,528363,142950,TQ283429,"Horley, Gatwick Airport",Crawley,1361,869,29479,12038,"RH77, RH10, RH1, RH11, RH2, RH7, RH9, CR5, RH3, KT20"
RH7,51.1744,-0.0183214,538626,143551,TQ386435,"Lingfield, Dormansland",Tandridge,322,238,8579,3362,"RH19, RH8, TN8, RH18, RH9, RH6, CR6, RH77, TN16, RH10"
RH8,51.2527,-0.000162144,539659,152292,TQ396522,"Oxted",Tandridge,634,400,15274,6014,"RH9, TN16, RH7, CR6, BR4, TN8, RH19, CR3, BR2, RH1"
RH9,51.2369,-0.0766436,534368,150392,TQ343503,"Godstone, South Godstone",Tandridge,198,153,5495,2196,"CR3, RH1, CR6, RH8, RH7, RH2, CR2, CR8, CR0, CR5"
RH10,51.1194,-0.164565,528557,137170,TQ285371,"Copthorne, Crawley Down, Domewood, Furnace Green, Northgate, Maidenbower, Pound Hill, Rowfant, Southgate, Three Bridges, Tilgate",Crawley,3233,1856,65902,26845,"RH77, RH11, RH6, RH1, RH17, RH2, RH19, RH16, RH15, BN6"
RH11,51.1123,-0.204855,525756,136311,TQ257363,"Bewbush, Broadfield, Gossops Green, Ifield, Langley Green, Lowfield Heath, Pease Pottage, Southgate West, West Green",Crawley,1525,1158,54793,21422,"RH10, RH77, RH6, RH2, RH12, RH1, RH17, RH3, KT20, RH13"
RH12,51.0747,-0.329554,517123,131924,TQ171319,"Horsham, Broadbridge Heath, Rusper, Rudgwick, Warnham",Horsham,2022,1328,43862,18438,"RH13, RH5, RH4, RH11, BN44, RH14, RH3, RH10, BN5, GU6"
RH13,51.0384,-0.333019,516971,127882,TQ169278,"Barns Green, Cowfold, Mannings Heath, Partridge Green, Slinfold, Southwater, West Grinstead",Horsham,1840,1108,38023,15199,"RH12, RH14, BN44, RH5, BN5, RH4, RH11, BN15, BN95, RH17"
RH14,51.0314,-0.479649,506707,126881,TQ067268,"Billingshurst, Ifold, Kirdford, Loxwood, Plaistow, Wisborough Green",Chichester,756,583,14175,5896,"RH20, GU6, RH13, GU28, RH12, GU5, BN16, BN12, BN17, BN13"
RH15,50.9567,-0.135812,531027,119129,TQ310191,"Burgess Hill, Ditchling Common",Mid Sussex,1198,840,31286,12558,"BN6, RH17, RH16, BN45, BN1, BN88, BN50, BN52, BN2, BN3"
RH16,51.0029,-0.0998604,533419,124330,TQ334243,"Haywards Heath, Lindfield",Mid Sussex,1666,1107,33930,14521,"RH17, RH15, BN6, RH10, BN2, BN45, RH77, BN1, RH19, RH11"
RH17,51.0201,-0.118664,532051,126209,TQ320262,"Ansty, Ardingly, Balcombe, Bolney, Chelwood Gate, Cuckfield, Danehill, Handcross, Hickstead, Horsted Keynes, Wivelsfield, Wivelsfield Green",Mid Sussex,915,703,18956,7371,"RH16, RH15, BN6, RH10, RH77, RH11, BN45, RH6, BN1, BN2"
RH18,51.1008,0.0251178,541888,135450,TQ418354,"Forest Row",Mid Sussex,233,143,4558,1809,"RH19, TN7, RH7, TN8, RH8, TN22, TN6, RH10, BN8, TN16"
RH19,51.1258,-0.0135028,539109,138156,TQ391381,"East Grinstead, Ashurst Wood, Dormans Park, Felbridge, Felcourt, Sharpthorne, West Hoathly",Mid Sussex,1721,1103,33639,13867,"RH7, RH18, RH8, RH10, TN7, TN8, RH77, RH9, RH6, RH11"
RH20,50.9374,-0.471748,507478,116440,TQ074164,"Pulborough, Ashington, Storrington, West Chiltington, West Chiltington Common",Horsham,1219,882,24754,10752,"RH14, BN16, BN12, BN13, BN17, BN18, BN44, BN14, GU28, BN5"
RM1,51.5802,0.182049,551289,189071,TQ512890,"Romford",Havering,914,495,20067,8629,"RM7, RM2, RM50, RM5, RM11, RM12, RM6, RM10, RM3, RM13"
RM2,51.5825,0.199326,552478,189363,TQ524893,"Gidea Park, Heath Park",Havering,406,266,13240,5646,"RM1, RM11, RM12, RM7, RM50, RM3, RM5, RM13, RM6, RM10"
RM3,51.6021,0.224256,554139,191594,TQ541915,"Harold Wood, Harold Hill, Noak Hill",Havering,1320,929,40272,16857,"RM11, RM2, RM12, RM5, RM1, RM14, RM7, RM50, CM14, RM4"
RM4,51.6331,0.161663,549702,194911,TQ497949,"Havering-atte-Bower, Abridge, Stapleford Abbotts, Noak Hill, Navestock, Stapleford Tawney, Stapleford Aerodrome",Havering,217,154,4290,1804,"RM5, RM7, RM50, RM1, RM6, RM2, RM10, IG7, RM3, RM8"
RM5,51.5981,0.165324,550071,191027,TQ500910,"Collier Row",Havering,485,374,19022,7564,"RM7, RM50, RM1, RM4, RM2, RM6, RM10, RM3, RM8, RM11"
RM6,51.575,0.133657,547953,188394,TQ479883,"Chadwell Heath, Little Heath",Barking and Dagenham,758,529,32913,12196,"RM8, RM9, RM7, RM50, IG3, RM10, RM1, RM5, IG2, IG6"
RM7,51.5733,0.169609,550450,188278,TQ504882,"Rush Green, Mawneys, Romford",Havering,1088,583,28008,11315,"RM50, RM1, RM5, RM6, RM2, RM10, RM11, RM8, RM12, RM9"
RM8,51.5572,0.130811,547813,186409,TQ478864,"Dagenham, Becontree Heath",Barking and Dagenham,805,592,38998,14839,"RM9, RM6, RM10, IG3, RM50, RM7, IG1, IG11, IG2, RM1"
RM9,51.5439,0.136543,548254,184941,TQ482849,"Dagenham, Becontree",Barking and Dagenham,920,539,36253,13668,"RM8, RM10, RM6, IG11, IG3, RM50, DA18, RM7, DA17, SE28"
RM10,51.5456,0.15656,549636,185171,TQ496851,"Dagenham",Barking and Dagenham,810,584,38157,14715,"RM9, RM8, RM50, RM7, RM6, RM13, RM1, RM5, RM12, DA18"
RM11,51.5696,0.218007,553816,187967,TQ538879,"Hornchurch, Emerson Park, Ardleigh Green",Havering,858,572,31339,12366,"RM12, RM2, RM3, RM1, RM50, RM7, RM14, RM13, RM5, RM10"
RM12,51.5547,0.208819,553229,186291,TQ532862,"Hornchurch, Elm Park",Havering,950,607,34663,14206,"RM11, RM2, RM13, RM1, RM14, RM50, RM7, RM10, RM3, RM8"
RM13,51.5236,0.1919,552160,182798,TQ521827,"Rainham, South Hornchurch, Wennington",Havering,946,606,29013,11724,"RM12, RM10, DA8, RM2, RM1, RM50, RM7, RM11, RM9, DA18"
RM14,51.5562,0.261068,556846,186568,TQ568865,"Upminster, Cranham, North Ockendon, Bulphan",Havering,889,623,26909,10844,"RM12, RM11, RM15, RM19, RM3, RM2, CM14, RM13, RM1, RM20"
RM15,51.509,0.276945,558110,181354,TQ581813,"South Ockendon, Aveley",Thurrock,771,565,27444,11144,"RM20, RM19, RM14, RM16, DA9, RM17, DA10, RM13, RM12, RM11"
RM16,51.4888,0.320301,561189,179203,TQ611792,"Chafford Hundred, Chadwell St Mary, North Stifford, Orsett",Thurrock,1239,698,41165,15709,"RM17, RM20, RM15, DA10, RM18, RM19, DA9, DA11, DA3, DA12"
RM17,51.4796,0.32604,561620,178192,TQ616781,"Grays, Badgers Dene",Thurrock,919,537,27310,11046,"RM16, RM20, RM18, DA10, DA11, RM19, DA9, RM15, DA12, DA3"
RM18,51.4676,0.370354,564740,176957,TQ647769,"Tilbury, East Tilbury, West Tilbury",Thurrock,476,335,16728,6327,"DA12, DA11, RM17, RM16, DA10, RM20, DA13, DA9, SS17, RM19"
RM19,51.4825,0.252305,556491,178354,TQ564783,"Purfleet",Thurrock,178,143,6532,2803,"RM20, RM15, DA9, DA2, RM16, RM17, DA1, DA8, RM14, DA10"
RM20,51.4788,0.28677,558896,178018,TQ588780,"West Thurrock, South Stifford",Thurrock,247,152,4982,1920,"DA9, RM19, RM17, RM15, RM16, DA10, RM18, DA2, RM14, DA11"
S1,53.3806,-1.46948,435388,387214,SK353872,"Sheffield City Centre",Sheffield,1434,498,9857,3218,"S3, S2, S4, S7, S8, S5, S10, S14, S11, S6"
S2,53.3715,-1.45082,436637,386211,SK366862,"Arbourthorne, Heeley, Highfield, Manor, Norfolk Park, Wybourn, Park Hill",Sheffield,1474,964,45174,18408,"S4, S1, S14, S3, S98, S99, S9, S96, S7, S8"
S3,53.3868,-1.47304,435146,387902,SK351879,"Broomhall, Burngreave, Neepsend, Netherthorpe",Sheffield,822,489,19140,7124,"S1, S4, S2, S5, S7, S8, S6, S10, S98, S99"
S4,53.3977,-1.4515,436569,389126,SK365891,"Grimesthorpe, Pitsmoor",Sheffield,454,300,13880,4893,"S98, S2, S99, S96, S9, S3, S1, S5, S14, S95"
S5,53.4223,-1.4622,435837,391857,SK358918,"Firth Park, Shirecliffe, Shiregreen, Southey Green, Parson Cross, Longley, Fir Vale, Wadsley Bridge",Sheffield,1238,1045,60467,24840,"S4, S3, S1, S99, S98, S96, S95, S2, S9, S6"
S6,53.4024,-1.50934,432720,389620,SK327896,"Bradfield, Hillsborough, Malin Bridge, Stannington, Upperthorpe, Walkley, Fox Hill",Sheffield,1728,1219,58239,26240,"S10, S11, S3, S1, S4, S5, S7, S35, S98, S99"
S7,53.3547,-1.4899,434050,384323,SK340843,"Abbeydale, Nether Edge, Millhouses, Carter Knowle",Sheffield,450,301,17457,6696,"S8, S11, S1, S3, S10, S14, S2, S6, S17, S18"
S8,53.3428,-1.47937,434761,383004,SK347830,"Batemoor, Beauchief, Greenhill, Jordanthorpe, Lowedges, Meersbrook, Norton, Norton Lees, Woodseats",Sheffield,1291,848,45911,20784,"S7, S14, S11, S1, S18, S3, S2, S17, S10, S12"
S9,53.3968,-1.421,438598,389041,SK385890,"Attercliffe, Brightside, Darnall, Meadowhall, Tinsley, Wincobank",Sheffield,1237,705,27903,10655,"S96, S98, S99, S95, S4, S2, S12, S3, S1, S5"
S10,53.3771,-1.51689,432237,386802,SK322868,"Broomhill, Broomhall, Crookes, Crookesmoor, Fulwood, Ranmoor, Crosspool",Sheffield,1454,918,48217,17792,"S11, S6, S7, S1, S3, S17, S2, S8, S4, S5"
S11,53.3607,-1.50807,432836,384982,SK328849,"Ecclesall, Endcliffe Park, Ecclesall Road, Greystones, Hunter's Bar, Millhouses, Sharrow Vale, Nether Edge",Sheffield,1071,660,34269,13813,"S7, S10, S6, S8, S17, S1, S3, S2, S14, S4"
S12,53.3498,-1.40904,439437,383819,SK394838,"Birley, Gleadless, Gleadless Townend, Hackenthorpe, Intake, Ridgeway",Sheffield,832,649,34897,15364,"S14, S13, S9, S2, S95, S96, S19, S20, S98, S99"
S13,53.3648,-1.38449,441056,385502,SK410855,"Handsworth, Richmond, Woodhouse",Sheffield,688,587,30708,13582,"S12, S19, S20, S9, S2, S95, S14, S96, S60, S98"
S14,53.3471,-1.44489,437053,383500,SK370834,"Gleadless Valley",Sheffield,208,183,9424,4394,"S2, S12, S8, S7, S4, S1, S3, S98, S99, S9"
S17,53.3226,-1.52606,431667,380735,SK316807,"Dore, Totley, Bradway",Sheffield,545,373,15483,6885,"S11, S10, S8, S7, S18, S6, S14, S1, S3, S2"
S18,53.2995,-1.47314,435211,378190,SK352781,"Coal Aston, Dronfield, Dronfield Woodhouse, Holmesfield, Unstone",North East Derbyshire,1361,589,24857,10831,"S8, S7, S14, S17, S1, S3, S2, S40, S11, S41"
S20,53.3342,-1.34969,443403,382118,SK434821,"Westfield, Waterthope, Sothall, Donetsk Way, Owlthorpe, Beighton, Crystal Peaks, Halfway, Mosborough",Sheffield,838,629,31211,13451,"S19, S21, S13, S31, S12, S43, S26, S60, S14, S65"
S21,53.3131,-1.33993,444075,379776,SK440797,"Eckington, Killamarsh, Renishaw, Spinkhill",North East Derbyshire,506,450,20778,8709,"S20, S19, S43, S31, S26, S13, S12, S44, S60, S14"
S25,53.3676,-1.21987,452008,385920,SK520859,"Anston, Dinnington, Laughton-en-le-Morthen",Rotherham,624,470,20863,8750,"S26, S66, S31, DN12, S81, S80, S20, S19, S13, S65"
S26,53.3553,-1.28747,447523,384505,SK475845,"Aston, Aughton, Harthill, Kiveton Park, Swallownest, Todwick, Wales",Rotherham,605,524,25865,10868,"S31, S25, S20, S19, S21, S66, S13, S65, S60, S12"
S33,53.3432,-1.73336,417850,382955,SK178829,"Bamford, Bradwell, Castleton, Edale, Hope, Yorkshire Bridge",High Peak,208,166,4974,2247,"S32, DE45, SK23, S17, S11, SK17, S10, S8, S7, S30"
S35,53.4581,-1.49522,433615,395824,SK336958,"Chapeltown, Ecclesfield, Grenoside, High Green, Oughtibridge, Thurgoland, Wharncliffe Side, Wortley",Sheffield,1029,870,41385,17731,"S5, S6, S3, S30, S74, S10, S1, S4, S70, S7"
S36,53.5052,-1.61615,425557,401014,SE255010,"Penistone, Thurlstone, Millhouse Green, Oxspring, Stocksbridge, Deepcar",Barnsley,898,733,27448,11883,"S30, S75, HD8, S35, S70, S74, WF12, S6, WF5, WF13"
S40,53.2346,-1.44349,437243,370985,SK372709,"Central and West Chesterfield, Brampton",Chesterfield,1613,1092,34971,16340,"S49, S41, S42, S45, S18, S14, S43, S44, S8, S2"
S41,53.2466,-1.42899,438200,372328,SK382723,"Hasland, North Chesterfield, Old Whittington",Chesterfield,1224,979,36451,16545,"S49, S40, S42, S45, S18, S43, S14, S12, S44, S8"
S42,53.2017,-1.42302,438639,367335,SK386673,"Holymoorside, Grassmoor, North Wingfield, Tupton, Wingerworth",Chesterfield,897,770,28248,12435,"S45, S49, S41, S40, S44, DE5, S18, S43, DE55, S12"
S43,53.2684,-1.34005,444113,374803,SK441748,"Barlborough, Clowne, Inkersall Green, Staveley",Chesterfield,1252,1053,40574,17571,"S21, S44, S20, S19, S41, S49, S31, S40, S26, S13"
S44,53.2257,-1.31259,445990,370071,SK459700,"Bolsover, Calow, Sutton-cum-Duckmanton, Scarcliffe",Bolsover,709,565,21703,9455,"S43, S21, S49, S42, S41, S40, NG20, S20, S31, S19"
S45,53.1675,-1.42149,438772,363532,SK387635,"Ashover, Clay Cross, Pilsley",North East Derbyshire,510,452,13727,6122,"S42, S49, S41, S40, DE5, DE55, S44, S43, S18, DE4"
S60,53.4168,-1.35255,443129,391306,SK431913,"Brinsworth, Catcliffe, Central Rotherham, Masbrough, Moorgate, Treeton, Whiston",Rotherham,1575,1030,38007,15402,"S65, S62, S95, S61, S19, S13, S20, S96, S9, S97"
S61,53.443,-1.39291,440422,394197,SK404941,"Greasbrough, Kimberworth, Rockingham, Thorpe Hesley",Rotherham,1001,859,35866,15515,"S95, S60, S62, S96, S9, S99, S98, S65, S73, S13"
S62,53.4662,-1.34522,443566,396806,SK435968,"Rawmarsh, Wentworth",Rotherham,736,608,19772,8539,"S97, S65, S60, S63, S64, S61, S73, S95, S74, S20"
S63,53.5171,-1.32991,444529,402478,SE445024,"Bolton-on-Dearne, Goldthorpe, Thurnscoe, Wath-on-Dearne, West Melton",Barnsley,1412,1116,37908,16235,"S97, S64, S62, S73, S65, WF9, S60, S72, S74, S61"
S64,53.4913,-1.29984,446551,399627,SK465996,"Kilnhurst, Mexborough, Swinton",Doncaster,810,673,30809,13330,"S97, S63, S62, S65, DN12, S66, S60, S73, WF9, S61"
S65,53.4361,-1.32182,445151,393472,SK451934,"Herringthorpe, Ravenfield, Thrybergh",Rotherham,985,805,35222,14648,"S60, S62, S64, S61, S97, S66, S63, S95, S26, S20"
S66,53.4213,-1.2515,449840,391872,SK498918,"Bramley Hellaby, Maltby, Thurcroft, Wickersley, Braithwell",Rotherham,1628,1077,45857,19247,"S65, S25, DN12, S26, S60, S31, S64, S62, S61, S95"
S70,53.5437,-1.47662,434780,405356,SE347053,"Central Barnsley, Birdwell, Stairfoot, Worsborough",Barnsley,1814,1274,38536,17627,"S71, S75, S74, S73, S35, S72, S5, WF4, WF90, S3"
S71,53.5733,-1.45737,436030,408658,SE360086,"Ardsley, Athersley, Monk Bretton, Royston",Barnsley,1395,1206,45219,19592,"S70, S72, S75, S74, S73, WF4, WF90, WF1, S35, WF2"
S72,53.5776,-1.39437,440198,409170,SE401091,"Brierley, Cudworth, Grimethorpe, Shafton, South Hiendley",Barnsley,822,707,25333,10636,"S73, S71, WF9, S70, S74, S63, S97, WF7, S61, S75"
S73,53.5243,-1.39561,440166,403240,SE401032,"Brampton, Darfield, Wombwell, Hemingfield",Barnsley,893,748,26977,11662,"S72, S74, S63, S97, S61, S70, S62, S71, S95, S64"
S74,53.5018,-1.44055,437207,400713,SE372007,"Elsecar, Hoyland, Jump",Barnsley,576,512,17839,7754,"S73, S70, S71, S35, S5, S97, S61, S99, S98, S96"
S75,53.5618,-1.51902,431957,407349,SE319073,"Barugh Green, Cawthorne, Darton, Dodworth, Gawber, Mapplewell, Pogmoor, Staincross, Wilthorpe",Barnsley,1538,1329,43568,18916,"S70, S71, WF4, WF2, WF90, S35, S74, S72, WF1, S36"
S80,53.295,-1.14667,456975,377899,SK569778,"Creswell, South Worksop, Whitwell",Bassetlaw,1310,986,29926,13068,"S81, NG20, S25, NG70, S31, NG19, NG21, NG18, S26, S21"
S81,53.3367,-1.12388,458437,382557,SK584825,"Blyth, Carlton-in-Lindrick, Langold, North Worksop, Shireoaks, Woodsetts",Bassetlaw,1212,1024,37451,15725,"S80, S25, DN11, S31, DN4, DN55, S26, DN1, NG20, DN22"
SA1,51.6292,-3.93865,265912,194045,SS659940,"Bonymaen, Copper Quarter, Crymlyn Burrows, Danygraig, Greenhill, Hafod, Jersey Marine, Landore, Maritime Quarter, Mayhill, Mount Pleasant, Pentrechwyth, Port Tennant, St. Thomas, City Centre, Townhill, Waun Wen, Winch Wen, Winch Wen Industrial Estate",Swansea,2300,1339,47397,22091,"SA80, SA99, SA5, SA2, SA6, SA7, SA3, SA4, SA12, SA8"
SA2,51.6216,-3.99103,262264,193297,SS622932,"Brynmill, Cockett, Derwen Fawr, Dunvant, Fairwood, Glanmor, Hendrefoilan, Hendrefoilan Student Village, Ilston, Killay, Sketty, Sketty Park, Singleton Park (University Campus), Tycoch, Uplands, Upper Killay",Swansea,960,777,38546,15351,"SA5, SA1, SA3, SA80, SA99, SA4, SA6, SA7, SA18, SA12"
SA3,51.5819,-4.04223,258597,188981,SS585889,"Bishopston, Blackpill, Caswell, Clyne, Langland, Mumbles, Oystermouth, Southgate, South Gower, West Cross",Swansea,956,725,26222,11844,"SA2, SA4, SA5, SA1, SA80, SA99, SA6, SA14, SA7, SA15"
SA4,51.6761,-4.04279,258851,199457,SS588994,"Blue Anchor, Gorseinon, Gowerton, Hendy (Carmarthenshire), Loughor, North Gower, Penllergaer, Penclawdd, Pontarddulais, Three Crosses",Swansea,2080,1124,44295,18652,"SA3, SA5, SA99, SA2, SA14, SA6, SA15, SA80, SA1, SA7"
SA5,51.6487,-3.96907,263866,196270,SS638962,"Blaenymaes, Cwmdu, Cwmdu Industrial Estate, Felindre, Fforestfach, Gendros, Llangyfelach, Llewitha, Manselton, Penlan, Portmead, Tirdeunaw, Waunarlwydd",Swansea,932,748,36390,15702,"SA99, SA80, SA2, SA1, SA6, SA7, SA4, SA3, SA18, SA8"
SA6,51.6748,-3.92146,267236,199085,SS672990,"Clase, Cwmrhydyceirw, Clydach, Morriston, Plasmarl, Plasmarl Industrial Estate, Swansea Enterprise Park, Ynystawe, Ynysforgan",Swansea,945,757,34017,14848,"SA99, SA80, SA7, SA1, SA5, SA8, SA4, SA2, SA10, SA11"
SA7,51.6632,-3.89399,269101,197745,SS691977,"Birchgrove, Glais, Llansamlet, Swansea Enterprise Park, Talycoppa, Trallwn",Swansea,425,343,15013,6212,"SA6, SA80, SA99, SA1, SA5, SA8, SA10, SA11, SA2, SA12"
SA8,51.7216,-3.84716,272504,204156,SN725041,"Alltwen, Cwmtawe, Pontardawe, Rhos, Rhyd-y-fro, Trebanos, Ynysmeudwy",Neath Port Talbot,387,306,12491,5282,"SA10, SA7, SA6, SA11, SA9, SA99, SA80, SA12, SA1, SA18"
